Creator,Imprint,Subject,Title,Series,Relation,Edition,Medium Type,Language
"Adams, George","London : Printed by J. Dillon, and Company, for, and sold by W. and S. Jones ..., 1799.","Galvani, Luigi,--1737-1798.   Electricity--Early works to 1850.   Electricity.  and others","An essay on electricity : explaining the principles of that useful science, and describing the instruments, contrived either to illustrate the theory, or render the practice entertaining : illustrated with six plates. To which is added, a letter to the author, from Mr. John Birch, surgeon, on the subject of medical electricity / by the late George Adams ...",,,"The 5th ed., with corrections and additions /",,English
"Pearson, John","London, J.F. Dove, 1824.",Apostles&apos; Creed Early works to 1800.   Apostles&apos; Creed.   Creeds.  and others,An exposition of the Creed.,,,A new and improved edition:,,English
"Pareus, David","Heidelbergae : Impensis Jon ̆Ros,̆ 1618.",Bible. Revelation Commentaries.   Bible. Revelation.   Commentaries. ,In divinam Apocalypsin S. Apostoli et evangelist ̆Johannis commentarius / authore Davide Pareo.,,,,,Latin
"MacGill, Stevenson","Edinburgh : Printed for Waugh and Innes ..., 1819.",Mentally ill--Care--Great Britain.   Prisons--Great Britain.   Mentally ill--Care.  and others,Discourses and essays on subjects of public interest / by Stevenson MacGill.,,,,,English
"Faber, George Stanley",Boston: Published by William Andrews. T.B. Wait and Company printers ... 1809.,Bible. Old Testament Prophecies.   Bible. Old Testament.   Jews--Restoration.  and others,"A general and connected view of the prophecies, relative to the conversion, restoration, union, and future glory of the houses of Judah and Israel; the progress, and final overthrow, of the antichristian confederacy in the land of Palestine; and the ultimate general diffusion of Christianity. By the Rev. George Stanley Faber.",,,,,English
"Abbadie, Jacques","A Amsterdam : Chez les Freres Wetstein ..., 1719.",Jesus Christ--Divinity--Early works to 1800.   Jesus Christ.   Divinity of Christ.  and others,Traité de la divinité de Notre Seigneur Jesus-Christ / par Mr. Abbadie.,,,Sixieme ed.,,French
"Callcott, John Wall","Boston: Published by West and Blake, and Manning and Loring. Manning and Loring, printers [1810]","Music--Handbooks, manuals, etc.   Music   Handbooks and manuals. ","A musical grammar, in four parts. I. Notation, II. Melody, III. Harmony, IV. Rhythm. By Dr. Callcott.",,,"1st American, from the last London ed.",,English
"Alison, Archibald","Boston: Cambridge, Printed by Hilliard and Metcalf, Cummings and Hilliard; 1812.",Aesthetics--Early works to 1800.   Aesthetics.   Early works. ,Essays on the nature and principles of taste. By Archibald Alison.,,,From the Edinburgh ed. of 1811.,,English
"Carey, William","Serampore : Printed at the Mission-Press, 1812.",Panjabi language--Grammar. ,A grammar of the Punjabee language / by W. Carey.,,,,,English
"Russell, William","Hanover, N.H. : Charles and Wm. S. Spear, 1810.",Since 1485   Europe--History--1492-   France--History.  and others,"The history of modern Europe : particularly France, England, and Scotland : with a view of the progress of society, from the rise of those kingdoms to the late revolutions on the continent / abridged from Russell's Modern Europe by a lady of Massachusetts.",,,,,English
"Chaptal, Jean-Antoine-Claude","Boston: Printed by J.T. Buckingham, for Thomas and Andrews, 1806.",Chemistry. ,Elements of chemistry. By M.J.A. Chaptal ... translated from the French.,,,3d American ed. Three volumes in one.,,English
Stewarton.,"Middletown (Conn.) Printed by Alsop, Riley and Alsop ... 1807.",1789 - 1815   Travel.   Europe--Description and travel.  and others,"A picture of the empire of Buonaparte, and his federate nations; or, The Belgian traveller: being a tour through Holland, France and Switzerland, during the years 1804-5. In a series of letters from a nobleman to a minister of state. Edited by the author of The revolutionary Plutarch, andc.",,,,,English
"Dickinson, Jonathan","Boston: Printed and sold by Rogers and Fowle in Queen-street, next to the prison: and by J. Blanchard at the Bible and Crown in Dock-square. 1745.",Apologetics.   Grace (Theology) ,"Familiar letters to a gentleman, upon a variety of seasonable and important subjects in religion. By Jonathan Dickinson, A.M., minister of the gospel at Elizabeth-town, New Jersey.",,,,,English
R. H.,"London : Printed for R. Smith ..., 1702.","Bible. Epistles of Paul Commentaries.   Bible. Epistles of Paul Paraphrases, English.   Bible. Epistles of Paul.  and others","A paraphrase and annotations upon all St. Paul's epistles. / Done by several eminent men at Oxford, corrected and improv'd by the late Right Reverend and Learned Bishop Fell.",,,The 3rd ed. with additions.,,English
"Bedell, William","London : British and Foreign Bible Society, 1817.","Provenance--British and Foreign Bible Society.   Provenance--Gabelentz, H.L.   Provenance--Gabelentz-Polmwitz, B.D.--Bookplate. ",An Biobla Naomhtha.,,,,,Irish
"Luther, Martin","London : Gedruckt auf Kosten der Grossbritannischen und Auslñdischen Bibel-Gesellschaft, 1814.",,"Die Bibel, oder die ganze Heilige Schrift des alten und neuen Testaments / nach der deutschen Uebersetzung D. Martin Luthers.",,,,,German
"Burghardt, C. F.","London : Printed by W. M'Dowall, 1813.",Eskimo languages--Texts.   Inuktitut dialect--Texts.   Eskimo languages.  and others,"The Gospels according to St. Matthew, St. Mark, St. Luke, and St. John : translated into the language of the Esquimaux Indians, on the coast of Labrador / by the missionaries of the Unitas Fratrum ; or, United Brethern, residing at Nain, Okkak, and Hopedale ; printed for the use of the mission, by the British and Foreign Bible Society.",,,,,Inuktitut
"Pearson, John","London : J.F. Dove, 1821.",Apostles&apos; Creed Early works in 1800.   Creeds. ,An exposition of the Creed / by John Pearson.,,,"New ed., carefully corr.",,English
"Burnet, Gilbert","London : Printed by T.H. for Richard Chiswell, 1681-1715.",Reformation--England.   Reformation.   England. ,The history of the reformation of the Church of England / by Gilbert Burnet.,,,"The 2nd ed., corrected.",,English
"Taylor, Jeremy","London : Printed by R. Norton for R. Royston, 1674.",Church of England.   1600 - 1699   Theology--Early works to 1800.  and others,Symbolon theologikon : or a collection of polemicall discourses ... together with some additional pieces addressed to the promotion of practical religion and daily devotion / by Jer. Taylor.,,,The 3rd ed. enl.,,English
"Cave, William","London : Printed by B.W. for Richard Chiswell ..., 1687.","30 - 600   Church history--Primitive and early church, ca. 30-600.   Fathers of the church--Biography.  and others","Apostolici: or, The history of the lives, acts, death, and martyrdoms of those who were contemporary with, or immediately succeeded the apostles. : As also the most eminent of the primitive fathers for the first three hundred years. To which is added, a chronology of the three first ages of the church. / by William Cave ...",,,The 3rd ed. corrected.,,English
"Newton, John","Philadelphia, Printed by William Young, 1795.",1700 - 1799   Theology--History--18th century.   Theology.  and others,"Letters originally published under the signatures of Omicron and Vigil by the Rev. Mr. John Newton ... to which is prefixed an authentic narrative of some remarkable and interesting particulars in the life of Mr. Newton communicated in a series of letters to the Rev. Mr. Haweis, Rector of Aldwinckle, Northamptonshire.",,,,,English
"Dyer, George","London, Printed for Longman, Hurst, Rees, Orme, and Brown 1814.",University of Cambridge--History.   University of Cambridge.   History. ,History of the University and colleges of Cambridge; including notices relating to the founders and eminent men. By G. Dyer ... Illustrated by a series of engravings ... [by John Greig].,,,,,English
"Alexander, Caleb","Bostoniae : Excudebat Esaias Thomas, Jun. typis Watson and Bangs, 1814.",,Hē Kainē Diathēkē = Novum Testamentum / juxta exemplar Joannis Millii accuratissime impressum.,,,,,"Greek, Modern (1453- )"
"Estienne, Henri","Genev[ae] : Oliva Pavli Stephani, anno M. DC. [1600]","Bible. Greek New Testament. Concordances, Greek.   Bible. New Testament.   Concordances. ","Concordantiæ Græcolatinæ Testamenti Novi, nunc primùm plenæ editæ : & diu multúmque desideratæ, vt optimæ duces ad veram vocum illius interpretationem futuræ. Accessit huic editioni svpplementvm eorvm omnivm qvæ ad calcem libri reiecta, quàm quæ omissa desiderari poterant. In his quid præstitum sit, præfixa ad lectorem epistola docet.",,,,,"Greek, Ancient (to 1453)"
"Stillman, Samuel","Boston : Manning and Loring, 1808.",Baptists--Sermons.   Baptists.   Sermons. ,Select sermons on doctrinal and practical subjects / by Samuel Stillman ; comprising several sermons never before published ; to which is prefixed a biographical sketch of the author's life.,,,,,English
"Bingham, Joseph","London : Printed for Robert Knaplock ..., 1726.","30 - 1799   Church history--Primitive and early church, ca. 30-600.   Theology--Early works to 1800.  and others","The works of the learned Joseph Bingham, M.A. ... : Containing I. Origines Ecclesiasticæ: or, The antiquities of the Christian Church. In twenty three books. II. A scholastical history of lay-baptism. In two parts. III. The French churches apology for the Church of England. IV. A discourse concerning the mercy of God to penitent sinners. In two volumes.",,,,,English
"Burnet, Gilbert","London Printed for A. Bettesworth and C. Hitch, 1737.",Church of England--Sermons.   Church of England.   Sermons. ,"A defence of natural and revealed religion: being an abridgment of the sermons preached at the lecture founded by the Honble Robert Boyle esq.; By Dr. Bentley [and others] ... With a general index. By Gilbert Burnet, vicar of Coggeshall, Essex.",,,,,English
Church of England. ,"London : Printed by J. Baskett, 1713.",Ecclesiastical law--Great Britain.   Ecclesiastical law.   Great Britain. ,"Codex juris ecclesiastici anglicani, or, The statutes, constitutions, canons, rubricks and articles, of the Church of England, methodically digested under their proper heads : with a commentary, historical and juridical : before it, is an introductory discourse, concerning the present state of the power, discipline and laws, of the Church of England : and after it, an Appendix of instruments, ancient and modern / by Edmund Gibson.",,,,,English
"Lardner, Nathaniel","London, Printed for John Chandler at the Cross Keys in the Poultry, 1727.","Bible. New Testament Evidences, authority, etc.   Bible. New Testament.   Apologetics.  and others","The credibility of the Gospel history: or, the facts occasionally mention'd in the New Testament; confirmed by passages of ancient authors, who were contemporary with our Saviour or his Apostles, or lived near their time. With an appendix concerning the time of Herod's death.",,,,,English
"King, William","London, Printed by F. Stephens, for W. Thurlbourn, 1732.",Fall of man.   Good and evil.   Predestination. ,"An essay on the origin of evil, by Dr. William King. Translated from the Latin, with notes; and a dissertation concerning the princilple and criterion of virtue and the origin of the passions. The second edition corrected and enlarged from the author' manuscripts. To which are added two sermons by the same author, the former concerning divine praescience; the latter on the fall of man. By Edmund Law.",,,,,English
"Ferguson, James","Philadelphia : Printed by and for Abraham Small, 1817.",Astronomy. ,"Astronomy : explained upon Sir Isaac Newton's Principles / [James] Ferguson ; with notes, and supplementary chapters by David Brewster.",,,,,English
"Walker, John",Boston : Printed and published by J.T. Buckingham : 1814.,Elocution. ,"A rhetorical grammar : in which the common improprieties in reading and speaking are detected and the true sources of elegant pronunciation are pointed out : with a complete analysis of the voice ... and the several figures of rhetoric : to which are added outlines of composition, or, plain rules for writing orations and speaking them in public / by John Walker.",,,1st Am. ed.,,English
"Sandeman, Robert",Edinburgh : Printed by A. Donaldson and J. Reid : 1762.,"Hervey, James,--1714-1758.--Theron and Aspasio.   Justification (Christian theology)--Early works to 1800.   Sandemanianism. ","Letters on Theron and Aspasio, addressed to the author, in two volumes.",,,The 3rd ed.,,English
"Bèze, Théodore de","Hanoviæ : Typis Wechelianis, sumptibus Danielis ac Dauidis Aubriorum, ac Clementis Schleichii, Anno MDCXXIV [1624]",Bible. Syriac New Testament. Translations into Latin.   Bible. New Testament.   Translations. ,"Testamenti Veteris Biblia Sacra, sive, Libri canonici priscæ Judæorum ecclesiæ a Deo traditi / Latini recens ex Hebræo facti, brevibusque scholiis illustrati ab Immanuele Tremellio, & Francisco Junio ; accesserunt libri qui vulgo dicuntur Apocryphi, Latinè redditi, & notis quibusdam aucti à Francisco Junio, multò omnes quàm antè emendatiùs editi & aucti locis innumeris ; quibus etiam adjunximus Novi Testamenti libros ex sermone Syro ab eodem Tremellio, & ex Græco à Theodoro Beza in Latinum versos, nostisqúe itidem illustratos.",,,"Editio septima, & germana ...",,Latin
"Ure, Andrew","Philadelphia : Desilver, 1821.",Chemistry--Dictionaries.   Mineralogy--Dictionaries.   Chemistry.  and others,"A dictionary of chemistry, on the basis of Mr. Nicholson's : in which the principles of the science are investigated anew, and its applications to the phenomena of nature, medicine, mineralogy, agriculture, and manufactures, detailed / by Andrew Ure.",,,"1st Amer. ed. with some additions, notes, and corrections by Robert Hare ; assisted by Franklin Bache.",,English
"Michaelis, Johann David","Gottingae : I.G. Rosenbusch, 1792.",Hebrew language--Dictionaries--Latin.   Hebrew language.   Dictionaries. ,"Supplementa ad Lexica hebraica, partes sex.",,,,,Latin
"Locke, John","Brattleboro, Vt. Printed by William Fessenden, for Thomas and Andrews, and John West, Boston, 1806.","Knowledge, Theory of. ","An essay concerning human understanding. By John Locke, gent. ... To which is prefixed the life of the author.",,,2nd American ed.,,English
"Wahl, Christian Abraham","Lipsiae : Apud J.A. Barth, 1822.","Greek language, Biblical--Dictionaries--Latin.   Greek language--Dictionaries--Latin.   Greek language, Biblical.  and others","Clavis Novi Testamenti philologica usibus scholarum et iuvenum theologiae studiosorum / auctore, Christ. Abrahamo Wahl.",,,,,"Greek, Ancient (to 1453)"
"Baines, Edward","London : Printed for Longman, Hurst, Rees, Orme, and Brown ... and James Harper, 1817.",War of 1812.   1789 - 1820   Diplomatic relations.  and others,"History of the wars of the French revolution : from the breaking out of the war in 1792, to the restoration of a general peace in 1815 ; comprehending the civil history of Great Britain and France during that period / by Edward Baines.",,,,,English
"Bingham, Caleb","Boston : Printed for Caleb Bingham and Company and sold at their bookstore, numbers 45, Cornhill, [1817]",1800 - 1870   Readers--1800-1870.   Readers.  and others,"The Columbian orator : containing a variety of original and selected pieces, together with rules, calculated to improve youth and others in the ornamental and useful art of eloquence / by Caleb Bingham.",,,Stereotype ed.,,English
"Griesbach, Jo. Jac.","Andover [Mass.], Printed by Flagg and Gould, 1814.",Bible. Gospels Commentaries.   Bible. Gospels.   Gold tooled leather (Binding)  and others,"A harmony in Greek of the Gospels, with notes, by William Newcome, D.D. Dublin 1778: reprinted from the text and select various readings of Griesbach, by the Junior class in the Theological seminary at Andover, under the superintendance of Moses Stuart ...",,,,,"Greek, Modern (1453- )"
"Adam, Robert","Philadelphia : Moses Thomas, 1818.",Deism.   Religions. ,"The religious world displayed : or, A view of the four grand systems of religion, Judaism, paganism, Christianity, and Mohammedism, and of the various existing denominations, sects, and parties in the Christian world : to which is subjoined a view of deism and atheism / by Robert Adam.",,,,,English
"Cudworth, Ralph","London, R. Priestly, 1820.",Atheism--Controversial literature.   Atheism.   Lord&apos;s Supper.  and others,"The true intellectual system of the universe: wherein all the reason and philosophy of atheism is confuted, and its impossibility demonstrated. With a discourse concerning the true notion of the Lord's supper; and two sermons, on 1 John II. 3, 4 and 1 Cor. XV. 57. By Ralph Cudworth, D.D.",,,A new ed.;,,English
"Thomson, William.","Kilmarnock : Printed for the author by H. Crawford, 1816.",Bible. Gospels Commentaries.   Bible. Gospels.   Commentaries. ,"The New Testament, translated from the Greek, and the four Gospels arranged in a harmony : ... with some preliminary observations and notes critical and explanatory / by William Thomson.",,,,,English
"Fristoe, William","Staunton [Va.] : Printed by William Gilman Lyford, 1808.",Ketocton Baptist Association--History.   Ketocton Baptist Association.   Primitive Baptists--Virginia--History.  and others,"A concise history of the Ketocton Baptist Association : wherein a description is given of her constitution, progress and increase, the intention in associating, the doctrines holden by her, reasons for the names of regular and separate Baptists, an account of the death of sundries, constitution and order of churches, the manner of administering baptism, of the ordination of ministers, bounds of the association, the doctrines preached, providing for the ministry, annual meetings, the number of ministers, of persecution, the mode of redress, of circular letters, objections to the Baptists replied to of good works, and of her civil policy / by William Fristoe.",,,,,English
"Waterland, Daniel","Cambridge : Printed for Corn. Crownfield, and W. Innys at the West End of St. Paul's, London, 1731.","Jesus Christ--Divinity.   Jesus Christ.   Clarke, Samuel,--1675-1729.--Scripture doctrine of the Trinity.  and others","A second vindication of Christ's divinity, or, A second defense of some queries relating to Dr. Clarke's scheme of the Holy Trinity ... / by Daniel Waterland.",,,2nd ed.,,English
"Knox, Vicesimus","London : Printed for Charles Dilly, 1790.",,"Winter evenings, or, Lucubrations on life and letters / by Vicesimus Knox.",,,"2nd ed., corr. and enl.",,English
"Owen, John","Carlisle (Pennsylvania) : Printed by George Kline, 1792.",Atonement--Early works to 1800.   Redemption--Early works to 1800.   Atonement.  and others,"The death of death in the death of Christ : being a treatise of the redemption and reconciliation that is in the blood of Christ, wherein the whole controversy about universal redemption is fully discussed : in four parts / by John Owen, D.D.",,,"1st American ed., carefully rev. and corrected.",,English
"Evans, John","Burlington [N.J.], published by Stephen C. Ustick, Dennis Heartt, printer, 1812.",Religions.   Sects. ,"A sketch of the denominations of the Christian world; accompanied with a persuasive to religious moderation. To which is prefixed an account of atheism, deism, theophilanthropism, Judaism, Mahometanism, and Christianity ... by John Evans.",,,5th American ed. ...,,English
"Chalmers, Thomas","Glasgow : Printed for Chalmers and Collins, 1821-26.",Labor movement--Great Britain.   Poor--Great Britain.   Pauvret ̌--Grande-Bretagne.  and others,The Christian and civic economy of large towns / by Thomas Chalmers.,,,,,English
"Brown, William","Philadelphia, B. Coles V.D.M. 1816.",Bible Bibliography.   Bible.   Missions--History.  and others,"The history of missions; or, Of the propagation of Christianity among the heathen, since the reformation, by William Brown, M.D., with an introductory preface and additional notes, by Benjamin Coles. Also, a short account of the first introduction of the gospel into the British isles, by Adam Clarke.",,,1st American ed.,,English
"Knox, John","Edinburgh : Printed for J. Ogle ... M. Ogle, Glasgow, Ogles, Duncan, and Cochran, London and T. Johnson, Dublin, 1814.",Reformation--Scotland.   Reformation.   Scotland--Church history.  and others,"The history of the reformation of religion within the realm of Scotland : containing the manner, and by what persons, the light of Christ's gospel has been manifested unto this realm ... together with the life of the author, and several curious pieces wrote by him ... / by Mr John Knox.",,,,,English
"Leland, John","London, B. Dod, 1757.","Leland, John,--1691-1766.   1700 - 1799   Apologetics--Early works to 1800.  and others","A view of the principal deistical writers that have appeared in England in the last and present century; with observations upon them, and some account of the answers that have been published against them. In several letters to a friend. By John Leland.",,,"3d ed., improved.",,English
"Griesbach, Jo. Jac.","Oxonii : E Typographeo Clarendoniano, 1808.",,"Novum Testamentum Græce : lectiones variantes, Griesbachii judicio iis quas textus receptus exhibet anteponendas, vel æquiparandas, adjecit Josephus White ...",,,,,"Greek, Ancient (to 1453)"
"Hutchinson, Thomas","Salem [Mass.] : Printed by Thomas C. Cushing, for Thomas and Andrews, Boston, 1795.","1600 - 1775   Massachusetts--History--Colonial period, ca. 1600-1775.   Massachusetts.  and others","The history of Massachusetts, from the first settlement thereof in 1628, until the year 1750 / by Thomas Hutchinson, esq. ...",,,3d ed.,,English
"Hopkins, Samuel","Boston : Printed and published by Lincoln and Edmands, 1811.","Theology, Doctrinal. ","The system of doctrines : contained in divine revelation, explained and defended. Showing their consistence and connexion with each other. To which is added a treatise on the millenium / by Samuel Hopkins.",,,2nd ed.,,English
"Abbadie, Jacques","Burlington, N.J., Printed by S.C. Ustick for Thomas Ustick, numbers 79, North Third street, Philadelphia, [1802]",Jesus Christ--Divinity--Early works to 1800.   Jesus Christ.   Divinity of Christ.  and others,"The deity of Jesus Christ essential to the Christian religion: a treatise on the divinity of Our Lord Jesus Christ; written originally in French, by James Abbadie.",,,"A new ed. of the English translation, rev., cor., and, in a few places abridged, by Abraham Booth.",,English
"Cave, William","Oxonii : E theatro Sheldoniano, apud Josephum Pote, 1740-43.","Orthodox Eastern Church, Greek. Liturgy and ritual.   Arianism.   Christian literature, Early--Bio-bibliography.  and others",Scriptorum ecclesiasticorum historia literaria : a Christo nato usque ad sæculum XIV. facili methodo digesta ... / autore Guilielmo Cave ...,,,Editio novissima ...,,Latin
"Burnet, Gilbert","London : J.F. Dove, 1820.",Reformation--England.   Reformation.   England. ,The history of the reformation of the Church of England : a new edition embellished with twenty-two portraits and frontispiece / Bishop Burnet.,,,,,English
"Schleusner, Johann Friedrich","Lipsiae : In Libraria Weidmannia, 1819.","Bible. New Testament Dictionaries.   Bible. New Testament.   Greek language, Biblical--Dictionaries.  and others",Novum lexicon Graeco-Latinum in Novum Testamentum / congessit et variis observationibus philologicis illustravit Ioh. Frieder. Schleusner.,,,Editio quarta emendatior et auctior.,,Latin
"Sewall, Thomas","Washington : Printed by Duff Green, 1828.",Medicine.   Physicians--Conduct of life. ,"A charge delivered to the graduating class of the Columbian College, D.C. at the medical commencement, March 22, 1827 / by Thomas Sewall.",,,,,English
"Snowden, Edgar.","Washington : P. Force, 1837.",Fourth of July orations. ,"An address delivered before the Enosinian Society of the Columbian College, D.C., July 4, 1837 / by Edgar Snowden. Published at the request of the Society.",,,,,English
Columbian College in the District of Columbia. Medical Department.,1839,"Columbian College in the District of Columbia.--Medical Department--Faculty.   George Washington University.--School of Medicine and Health Sciences--History.   National Medical College (Washington, D.C.)--Faculty.  and others","Dean's book : minute book, 1839-1904.",,,,,English
"Stennett, Joseph","London : Printed for J. Darby, D. Midwinter and A. Ward, J. Osborn and T. Longman, J. Noon, F. Clay, T. Cox, R. Ford, R. Hett and J. Gray, 1731-32.",Clergy--England--Biography.   Seventh-Day Baptists--Clergy--Biography.   Clergy.  and others,The works of the late reverend and learned Mr. Joseph Stennett : in five volumes : to which is prefix'd some account of his life.,,,,,English
"Tacitus, Cornelius.","London, T. Woodward, and J. Peele, 1737.",Rome--History.   Rome (Empire)   History. ,"The works of Tacitus, in four volumes. To which are prefixed, political discourses upon that author ...",,,"2d ed., corr.",,English
"Almon, John","London : Longman, 1810.","Pitt, William,--Earl of Chatham,--1708-1778.   1714 - 1789   Statesmen--Great Britain--Biography.  and others","Anecdotes of the life of the Right Hon. William Pitt, earl of Chatham, and of the principal events of his time : with his speeches in Parliament, from the year 1736 to the year 1778.",,,"7th ed., corr.",,English
