Creator,Imprint,Subject,Title,Series,Relation,Edition,Medium Type,Language
"Schaaf, Carolus","Lugduni Batavorum : Typis Joh. Mulleri, Joh. fil. : 1709.","Bible. New Testament Early works to 1800. Concordances, Syriac   Bible. New Testament. Concordances syriaques Ouvrages avant 1800.   Nieuwe Testament.  and others","Lexicon Syriacum concordantiale : omnes Novi Testamenti Syriaci voces, et ad harum illustrationem multas alias Syriacas & linguarum affinium dictiones complectens : cum necessariis indicibus, Syriaco and Latino, ut & catalogo nominum propriorum ac gentilium New Testament Syr. / indefesso labore elaboratum à Carolo Schaaf.",,,,,Latin
"Browne, Peter","Dublin : printed by Joseph Ray in Essex street, for John North in Skinner row, 1697.","Toland, John,--1670-1722.--Christianity not mysterious.   Christianity not mysterious (Toland, John)   Deism. ","A letter in answer to a book entitled, Christianity not mysterious : as also to all those who set up for reason and evidence in opposition to revelation and mysteries / by Peter Browne ...",,,,,English
"Prynne, William","London, Printed by R.C. for Michael Sparke Senior, dwelling at the Blue Bible in Greene Arbour, 1642.",Catholic Church--Controversial literature.   Catholic Church.   Controversial literature. ,"A Pleasant Pvrge, For A Roman Catholike, To evacuate his Evill Humovrs. Consisting of a Century of Polemicall Epigrams; wherein divers grosse Errors, and Corruptions of the Church of Rome are discovered, censured, refuted, in a facetious, yet serious manner. By William Prynne, an Vtter-Barrester of Lincolnes-Inne; who composed these Poems, to solace himselfe, in his late tedious Imprisonments ...",,,,,English
"Marsden, William","London : Printed for the author by Cox and Baylis, 1812.",English language--Dictionaries--Malay.   Malay language--Dictionaries--English.   English language.  and others,"A dictionary of the Malayan language in two parts, Malayan and English and English and Malayan / by William Marsden.",,,,,English
"Hooght, Everardus van der","New-York: published by Whiting and Watson: composed and printed by Fanshaw and Clayton; stereotyped by D. and G. Bruce, 1815.",Bible. 1815. Hebrew. Old Testament.   Bible. Old Testament. ,The Hebrew Bible; from the edition of Everardo van der Hooght.,,,,,Hebrew
"White, Joseph","Printed at Boston : By William Greenough for Ebenezer Larkin, Jun. ..., 1793.",Church of England--Missions--India--Early works to 1800.   Church of England.   1700 - 1799  and others,"Sermons preached before the University of Oxford, in the year 1784, at the lecture founded by the Rev. John Bampton, M.A. late Canon of Salisbury : to which is now added a sermon preached before the University of Oxford, July 4, 1784, on the duty of attempting the propagation of the gospel among our Mahometan and Gentoo subjects in India / by Joseph White ...",,,First American edition.,,English
"Scio de San Miguel, Felipe","Londres : B. Bensley, 1821.",,"La Biblia, ó el Antiguo y Nuevo Testamento traducidos al español de la Vulgata latina / por Phelipe Scio de S. Miguel.",,,,,Spanish
"Butler, Joseph","London : Printed for John and Paul Kanpton, at the Crown in Ludgate Street, 1736.",Natural theology--Early works to 1800.   Analogy (Religion)   Natural theology.  and others,"The analogy of religion, natural and revealed, to the constitution and course of nature : to which are added two brief dissertations : I. Of personal identity. II. Of the nature of virtue / by Joseph Butler, L.L.D.",,,"The 2nd ed., corrected.",,English
"Giustiniani, Agostino","[Genuæ]̆ : Impressit ... Petrus Paulus Porrus, Genuæ ..., 1516.","Columbus, Christopher. ","Psalterium, Hebreum, Grecu[m], Arabicu[m], & Chaldeu[m], : cu[m] tribus Latinus i[n]terp[re]tat[i]o[n]ibus & glossis ...",,,,,Latin
Columbian College in the District of Columbia. Library.,London. 1815,Bible Periodicals.   Bible.   Theology--Periodicals.  and others,Bible magazine and theological review.,,,,,English
"Cave, William","London, Printed by J.R. for Richard Chiswel, 1683.",Fathers of the church--Biography.   Apostolic Fathers.   Arianism.  and others,"Ecclesiastici: or, The history of the lives, acts, death, and writings, of the most eminent Fathers of the Church, that flourisht in the fourth century. Wherein among other things an account is given of the rise, growth, and progress of Arianism, and all other sects of that age descending from it. Together with an introduction, containing an historical account of the state of paganism under the first Christian emperours. By William Cave ...",,,,,English
"Belsham, Thomas","Boston : Wells and Lilly, 1816.",Unitarianism. ,"Tracts on the Unitarian controversy, published in 1815.",,,,,English
"Schoenemann, Karl Traugott Gottlob","Lipsiae, In libraria Weidmannia, 1792-94.","Fathers of the church, Latin--Bio-bibliography.   Fathers of the church, Latin.   Bio-bibliography. ","Car. Traugott Gottlob Schoenemann ... Bibliotheca historico-literaria Patrum Latinorum a Tertulliano principe vsque ad Gregorium M. et Isidorum Hispalensem, ad Bibliothecam Fabricii Latinam accommodata.",,,,,Latin
Xenophon. ,"Philadelphia : Ex Officina Classica, impensis Wm. Poyntell et Soc., 1806.","Cyrus,--the Great, King of Persia,---530 B.C. or 529 B.C.   Kings and rulers.   Iran--Kings and rulers--Biography.  and others","Xenophōntos Kyrou paideias biblia oktō. = Xenophontis De Cyri institutione libri octo. Graeca recognovit, cum codice manuscript Oxoniensi et omnibus fere libris editis contulit, plurimis in locis emendavit, versionem Latinam reformavit, observationibus suis, tabulaque geographica auxit et illustravit: / Notas quoque H. Stephani, Leunclavii, Ae. Porti et Mureti recensitas et castigatas, variantium lectionum delectum, indicesque necessarios adjunxit Thomas Hutchinson.",,,Editio prima Americana: /,,"Greek, Ancient (to 1453)"
"Edwards, Jonathan","New Haven, Printed by A. Morse, 1790.","Chauncy, Charles,--1705-1787.--Salvation of all men.   Future life.   Future punishment. ","The salvation of all men strictly examined and the endless punishment of those who die impenitent, argued and defended against the objections and reasonings of the late Rev. Doctor Chauncy, of Boston, in his book entitled ""The salvation of all men.""",,,,,English
"Knapp, Georg Christian","Halis Saxonum : Orphanotrophei, 1824.",,Hē Kainē Diathēkē = Novum Testamentum graece / recognovit atque insignioris lectionum varietatis et argumentorum notationes subiunxit Georg. Christian. Knappius.,,,Ed. 3.,,"Greek, Ancient (to 1453)"
"Scott, John. ","London : at at Mr. Woodfall's, printer ; and at Mr. Hawkins's, bookseller, Printed for the author, and to be had at his House, in Orchard-street, Westminister ; 1754.","Jesus Christ--Divinity.   Clayton, Robert,--1695-1758.--Essay on spirit.   Newton, Isaac,--1642-1727.--Principia.  and others","The Holy Scriptural doctrine of the divine Trinity in essential unity : and the supreme Godhead of Jesus Christ being one and the same with his Father's ... Wherewith is occasionally shewn, that although the Newtonian philosophy be formally and mathematically true ; yet it is materially and physically false. To which is prefixed a prefatory discourse, wherein the physical, metaphysical, and theological errors of a late treatise, entitled, an Essay on spirit [by R. Clayton] are clearly shewn and confuted / by John Scott.",,,,,English
"Collier, Jeremy","London, D. Brown, 1722.",Conduct of life--Early works to 1900.   Conduct of life.   Early works. ,"Essays upon several moral subjects; in two parts, by Jeremy Collier.",,,"6th ed., corr. and enl.",,English
"Hodgson, James","London : Sold by W. Mount and T. Page ..., W. Innys and R. Manby ..., B. Motte and C. Bathurst ..., J. Clarke ..., and J. Stagg ..., Printed by T. Wood, for the author ; MDCCXXXVI [1736]",Calculus--Early works to 1800.   Calculus.   Early works. ,"The doctrine of fluxions : founded on Sir Isaac Newton's method, published by himself in his tract upon the quadrature of curves / by James Hodgson, F.R.S. and master of the Royal Mathematical-School in Christ-Hospital.",,,,,English
"Sykes, Arthur Ashley","London : J. Knapton, 1720.",Church of England--Clergy.   Church of England.   Clergy. ,The authority of the clergy and the liberties of the laity stated and vindicated : in answer to Mr. Rogers's discourse of the visible and invisible church of Christ / by Arthur Ashley Sykes ...,,,,,English
"Foster, James","London : Printed for J. Noon, 1733.","Sermons, English. ",Sermons on the following subjects ... / by James Foster.,,,2d ed.,,English
"Sykes, Arthur Ashley","London : Printed for J. and P. Knapton ..., MDCCXLIV [1744]","Newton, Isaac,--1642-1727.--Chronology of ancient kingdoms amended.   Warburton, William,--1698-1779.--Divine legation of Moses.   Warburton, William,--1698-1779.--Divine legislation of Moses.  and others","An examination of Mr. Warburton's account of the conduct of the antient legislators, of the double doctrine of the old philosophers, of the theocracy of the Jews, and of Sir Isaac Newton's Chronology / by Arthur Ashley Sykes ...",,,,,English
"Bèze, Théodore de","Cantabrigiae, ex officina Rogeri Danielis, 1642.","Bible. New Testament Criticism, interpretation, etc.   Bible. New Testament.   Criticism, interpretation, etc. ","Jesu Christi Domini Nostri Novum Testamentum, sive Novum Foedus, cujus Graeco contextui respondent interpretationes duae: una, vetus; altera, Theodori Bezae. Ejusdem Theod. Bezae Annotationes, in quibus ratione interpretationis vocum redditâ, additur synopsis doctrinae in evangelica historia, & Epistolis Apostolicis comprehensae, & ipse quoque contextus quasi brevi commentario explicatur. Omnia nunc demum, ultimâ adhibitâ manu, ex collatione exemplarium omnium quàm accuratissimè emendata, & aliquantulum aucta. Accessit Joachimi Camerarii in Novum Foedus commentarius, in quo & figurae sermonis, & verborum significatio, & orationis sententia, ad illius Foederis intelligentiam certiorem, tractantur.",,,,,Latin
Columbian College in the District of Columbia. Library.,"London, Printed for John Noon, Thomas Cox ... [and others] 1735.",Catholic Church--Doctrines--Protestant authors.   Rooms-Katholieke Kerk. ,"Sermons against popery, preached at Salters-Hall in the year 1735. By several ministers.",,,,,English
"Hare, Francis","Cantabrigiæ Nov-Anglorum, Typis academicis excudebant Hilliard et Metcalf, 1809.",,"Sefer tehillim. Liber Psalmorum hebraïce cum notis selectis ex editione Francisci Hare ... et cum selecta lectionum varietate ex edition Vet. Test. heb. Benj. Kennicott, S.T.P.",,,,,Hebrew
Columbian College in the District of Columbia. Library.,"Londini : Typis excudebat A. Macintosh, 1817.",,[Brit ḥdshh ʻl pi mshiḥ : nʻtk mlshon yon llshon ʻbri (romanized form)].,,,,,Hebrew
"Sykes, Arthur Ashley","London, A. Millar, 1756.",Redemption--Biblical teaching. ,The Scripture doctrine of the redemption of man by Jesus Christ in two parts ... by Arthur Ashley Sykes.,,,,,English
Diodorus,"London, Awnsham and J. Churchil, 1700.","History, Ancient. ","The historical library of Diodorus the Sicilian. In fifteen books. The first five, contain the antiquities of Egypt, Asia, Africa, Greece, the islands, and Europe. The last ten, an historical account of the affairs of the Persians, Grecians, Macedonians, and other parts of the world. To which are added, the fragments of Diodorus that are found in the Bibliotheca of Photius: together with those publish'd by H. Valesius, L. Rhodomannus, and F. Ursinus. Made English, by G. Booth.",,,,,English
"Geddes, Michael","London, Printed by E.F. for Bernard Lintott, 1715.","Luna, Alvaro de,---1453--Early works to 1800.   Catholic Church--Controversial literature--Early works to 1800.--Protestant authors ",Several tracts against popery; together with the life of Don Alvaro de Luna. Written by Michael Geddes.,,,,,English
"Wollaston, William","London : Printed by S. Palmer, and sold by B. Lintott, W. and J. Innys, J. Osborn, J. Batley, and T. Longman, 1725.",Ethics--Early works to 1800.   Natural theology--Early works to 1800.   Ethics.  and others,The religion of nature delineated.,,,,,English
"Newton, Isaac","London. Printed for W. Innys, 1730.",Optics--Early works to 1800.   Optics.   Optics  and others,"Opticks : or, A treatise of the reflections, refractions, inflections and colours of light. By Sir Isaac Newton, knt.",,,"4th ed., cor.",,English
"Waterland, Daniel","Cambridge : Printed for Corn. Crownfield ... and W. and J. Innys ... London., 1720.","Jesus Christ--Divinity--Early works to 1800.   Clarke, Samuel,--1675-1729.--Modest plea, etc. continued.   Hallet, Joseph,--1692?-1744.--Unity of God not inconsistent with the divinity of Christ. ","Eight sermons preach'd at the Cathedral Church of St. Paul : in defense of the divinity of our Lord Jesus Christ ... With a preface containing remarks upon two late pamphlets: one intit'led, Modest plea andc. continued andc. The other, Unity of God not inconsistent with the divinity of Christ andc. / by Dan. Waterland ...",,,,,English
"Sykes, Arthur Ashley","London, J. and P. Knapton, 1740.",1700 - 1799   Apologetics--Early works to 1800.   Apologetics--History--18th century.  and others,Principles and connexion of natural and revealed religion distinctly considered. By Arthur Ashley Sykes.,,,,,English
"Locke, John","London : Printed for Awnsham and John Churchill, at the Black Swan in Pater-Noster-Row, and Samuel Manship, at the Ship in Cornhill, near the Royal Exchange, MDCCVI [1706]","Knowledge, Theory of.   Autographs (Provenance)--18th century. ","An essay concerning humane understanding : in four books / written by John Locke, Gent.",,,"The fifth edition, with large additions.",,English
"Conybeare, John","London : Printed for S. Wilmot ... and sold by James and John Knapton, R. Knaplock, W. Innys, T. Astley, J. Crownfield ... J. Battley, C. Hitch ... S. Birt ... R. Williamson, and T. Osborn ..., MDCCXXXII [1732]","Tindal, Matthew,--1653?-1733.--Christianity as old as the creation.   Apologetics--Early works to 1800.   Apologetics--History--18th century.  and others","A defence of reveal'd religion : against the exceptions of a late writer, in his book, intituled, Christianity as old as the creation, andc. / by John Conybeare, D.D., Rector of Exeter-College in Oxford ...",,,The 2nd ed.,,English
"Clarke, Samuel","London, J. and J. Knapton, 1732.",1700 - 1799   Apologetics--Early works to 1800.   Apologetics--History--18th century.  and others,"A discourse concerning the being and attributes of God, the obligations of natural religion, and the truth and certainty of the Christian revelation ...",,,8th ed.,,English
"Leland, John","London : Printed for Richard Hett, at the Bible and Crown in the Poultry, 1739.","Morgan, Thomas,---1743.--Moral philosopher.   Bible Evidences, authority, etc. ","The divine authority of the Old and New Testament asserted : with a particular vindication of the characters of Moses, and the prophets, our Saviour Jesus Christ, and his apostles, against the unjust aspersions and false reasonings of a book, entitled, the moral philosopher / by John Leland ...",,,"The second edition, corrected.",,English
"Gale, John","London, Printed by J. Darby, 1711.","Wall, William,--1647-1728.--History of infant baptism.   Infant baptism.   Kinderdoop.  and others","Reflections on Mr. Wall's History of infant-baptism, in several letters to a friend.",,,,,English
Columbian College in the District of Columbia. Library.,"Shacklewell, dai torchj di T. Rutt, 1816.",,Il Nuovo Testamento del Nostro Signore Gesu Christo.,,,Ed. stereotipa.,,Italian
"Watts, Isaac","Boston, Isaiah Thomas 1812.",Education.   Logic.   Self-culture.  and others,The improvement of the mind. To which is added a discourse on the education of children and youth. By Isaac Watts. From the last London edition.,,,,,English
"Marsy, François-Marie de","Paris : Chez Desaint and Saillant, 1755-71.","Rollin, Charles,--1661-1741.   Buccaneers.   History, Modern.  and others","Histoire moderne des Chinois, des Japonnois, des Indiens, des Persans, des Turcs, des Russiens, andc. : pour servir de suite à l'Histoire ancienne de M. Rollin.",,,"Nouv. éd., rev. & corr.",,French
"Ferguson, James","London : Printed for W. Strahan, J. and F. Rivington, W. Johnston, J. Hinton, T. Longman ... [and 6 others], MDCLXXIII [id est 1773]",Astronomy--Early works to 1800.   Astronomy.   Early works. ,"Astronomy explained upon Sir Isaac Newton's principles, and made easy to those who have not studied mathematics : to which are added, a plain method of finding the distances of all the planets from the sun, by the transit of Venus over the sun's disc, in the year 1761 ... / by James Ferguson.",,,"A new ed., corrected.",,English
"Robinson, Robert","Boston: : From the press of Lincoln and Edmands ..., 1817.",Baptism--Baptists.   Baptism--History. ,"The history of Baptism. / By Robert Robinson. ; Edited by David Benedict, A.M.",,,,,English
"Bryant, Jacob","London, Printed for J. Walker 1807.","History, Ancient.   Mythology. ","A new system; or, An analysis of antient mythology ... By Jacob Bryant ... With a portrait and some account of the author; a vindication of the Apamean medal ... a complete index, and 41 plates ...",,,3d ed. ...,,English
"Berkeley, George","London: : Printed (by assignment from the executors of the late Mr. Tonson) for J. Beecroft, in Pater-noster Row., M DCC LXVII. [1767]",1700 - 1799   Apologetics--Early works to 1800.   Apologetics--History--18th century.  and others,"Alciphron: or, The minute philosopher. : In seven dialogues. Containing an apology for the Christian religion, against those who are called free-thinkers.",,,The fourth edition.,,English
"Volney, C.-F. ","Paris : Desenne, 1792.",Ethics.   History--Philosophy.   Revolutions. ,"Les ruines, ou, Méditation sur les révolutions des empires / par M. Volney.",,,2e éd.,,French
"Arias Montano, Benito","Philadelphiae : Ex Officina Classica, impensis S.F. Bradford, 1806.",,"Hē Kainē Diathēkē = Novum Testamentum : cum versione Latina Ariae Montani, in quo tum selecti versiculi 1900, quibus omnes Novi Testamenti voces continentur, asteriscis notantur, tum omnes and singulae voces, semel vel saepius occurrentes, peculiari nota distinguuntur / auctore Johanne Leusden.",,,Editio prima Americana /,,"Greek, Ancient (to 1453)"
"More, Henry","London : Printed by J. Flesher, for W. Morden Bookseller in Cambridge, 1660.","Christianity.   Christianity--Essence, genius, nature.   English imprints, 17th century, 1660. ","An explanation of the grand mystery of Godliness; : or, A true and faithfull representation of the everlasting gospel of our Lord and Saviour Jesus Christ, the onely [sic] begotten son of God and sovereign over men and angels. / By H. More ...",,,,,English
"Desaguliers, J. T. ","London : Printed for W. Mears ... and J. Sackfield ..., 1719.",Physics--Early works to 1800.   Physics.   Early works. ,"Lectures of experimental philosophy : wherein the principles of mechanicks, hydrostaticks, and opticks, are demonstrated and explained at large, by a great number of curious experiments : with a description of the air-pump, and the several experiments thereon : of the condensing engine, as also of the different species of barometers, thermometers, and hygrometers : with several experiments to prove Sir Isaac Newton's Theory of light and colours, as performed in a course of mechanical and experimental philosophy ... illustrated with several curious copper plates suitable to each subject : to which is added, a description of Mr. Rowley's machine, called the orrery, which represents the motion of the moon about the Earth, Venus and Mercury about the Sun, according to the Copernican System : all carefully examined and corrected by Mr. Desaguliers / by J.T. Desaguliers ...",,,The 2nd ed.,,English
"Wollaston, William","London : Re-printed in the year 1724 by Sam. Palmer and sold by Bernard Lintott ..., 1724.",Natural theology--Early works to 1800.   Natural theology.   Blind tooled bindings (Binding).  and others,The religion of nature delineated ...,,,,,English
"Hopkins, Ezekiel","London, J. Robinson 1710.",Church of England.   1600 - 1699   Theology--Early works to 1800.  and others,"The works of ... Ezekiel Hopkins, late lord bishop of London-Derry in Ireland ... containing: I. The vanity of the world. II. A practical exposition on the Ten commandments. III. An exposition on the Lord's prayer ... IV. Several sermons and discourses on divers important subjects. With an alphabetical table to the whole.",,,The 3d ed.,,English
"Newton, Isaac","Londini : Impensis Sam. Smith and Benj. Walford, 1706.","Newton, Isaac,--1642-1727--Early works to 1800.   Newton, Isaac,--1642-1727--Translations into Latin--Early works to 1800.   Newton, Isaac,--1642-1727  and others","Optice, sive De reflexionibus, refractionibus, inflexionibus and coloribus lucis libri tres / authore Isaaco Newton ... ; Latine reddidit Samuel Clarke ...",,,,,Latin
"Gastrell, Francis","London : Printed by W.B. for W. and J. Innys, 1721.",Bible Indexes.   Bible.   Indexes. ,"The Christian institutes, or, The sincere word of God : being a plain and impartial account of the whole faith and duty of a Christian : collected out of the writings of the Old and New Testament: digested under proper heads, and delivered in the words of Scripture / by the Right Reverend Father in God, Francis, Lord Bishop of Chester.",,,4th ed.,,English
"Charron, Pierre","London, Printed for R. Bonwick 1707.","Charron, Pierre,--1541-1603.   Ethics--Early works to 1800.   Ethics.  and others","Of wisdom. Three books. Written originally in French, by the Sieur de Charron. With an account of the author. Made English by George Stanhope.",,,"2d ed., corr.",,English
British and Foreign Bible Society.,"London : Printed by Tilling and Hughes for the British and Foreign Bible Society, 1817.",,Le Nouveau Testament de notre seigneur Jésus-Christ.,,,,,English
"Justinus, Marcus Junianus.","Dublini : Impensis Johannis Exshaw, 1781.","History, Ancient. ",Justini Historiarum ex Trogo Pompeio libri XLIV : ad optimorum exemplarium fidem recensiti.,,,"Editio novissima, ab innumeris erroribus emendata /",,Latin
"Baxter, Andrew","London : Printed for T. Cadell ..., M. DCC. LXXIX. [1779]","Priestley, Joseph,--1733-1804.   Immortality--Early works to 1800.   Immortality.  and others",The evidence of reason in proof of the immortality of the soul : independent on the more abstruse inquiry into the nature of matter and spirit / collected from the manuscripts of Mr. Baxter ... To which is prefixed a letter from the editor to the Reverend Dr. Priestley.,,,,,English
"Linné, Carl von","London : R. and J. Dodsley, 1762.",Ecology--Early works to 1800.   Ecology.   Natural history.  and others,"Miscellaneous tracts relating to natural history, husbandry, and physick. : To which is added The calendar of flora / by Benj. Stillingfleet.",,,The 2nd ed. :,,English
"Dodd, William","London printed: Boston, Re-printed for T. Leverett, 1773.",Death. ,"Reflections on death, by William Dodd.",,,5th ed.,,English
"Grotius, Hugo","Edinburgh : Printed by W. Darling ..., 1779.",1600 - 1699   Apologetics--Early works to 1800.   Apologetics--History--17th century.  and others,"The truth of the Christian religion : in six books / by Hugo Grotius. Corrected and illustrated with notes, by Mr. Le Clerc. Translated by John Clarke ...",,,The 8th ed.,,English
"Sidney, Algernon","London : Printed by W. Strahan Iun. for T. Becket and Company and T. Cadell in the Strand, T. Davies in Russel Street, and T. Evans in King Street, 1772.","Sidney, Algernon,--1623-1683.   Sidney, Algernon,--1623-1683   Political science. ",The works of Algernon Sydney.,,,New ed.,,English
"Wardlaw, Ralph","London : Printed for Longman, 1819.",Socinianism.   Trinity. ,Discourses on the principal points of the Socinian controversy. / by Ralph Wardlaw.,,,3d ed.,,English
"DeCordova, Joshua Hezekiah","Philadelphia : Printed by F. Bailey, numbers 116, Yorick's Head, Market Street, 1791.",Faith. ,"Reason and faith : or, Philosophical absurdities and the necessity of revelation intended to promote faith among infidels and the unbounded exercise of humanity among all religious men / by one of the sons of Abraham to his brethren.",,,,,English
"Carey, William","[Serampore], [Mission Press], [1811]",Marathi language--Texts.   Marathi language.   Texts. ,"The New Testament, translated into the Mahratta language.",,,,,Marathi
"Carey, William","Serampore : Mission Press, 1806.",Bengali language--Conversation and phrase books.   Bengali language.   Conversation and phrase books. ,"Dialogues, intended to facilitate the acquiring of the Bengalee language.",,,2nd ed.,,English
"Luther, Martin","[England?] : [publisher not identified], [16--?]",Sermons. ,[Luther's sermons].,,,,,English
"Cleland, James","Glasgow, Printed by J. Hedderwick, 1816.",Glasgow (Scotland)--History.   Scotland--Glasgow.   History. ,"Annals of Glasgow, comprising an account of the public buildings, charities, and the rise and progress of the city. By James Cleland ...",,,,,English
"Bretschneider, Karl Gottlieb","Lipsiae : Sumptibus Jo. Ambros. Barthii, 1824.","Greek language, Biblical--Dictionaries--Latin.   Greek language, Biblical.   Dictionaries. ",Lexicon manuale Graeco-Latinum in libros Novi Testamenti / auctore Carolo Gottlieb Bretschneider.,,,,,Latin
"Henke, Heinrich Konrad","Braunschweig : Verlag der Schulbuchhandlung, 1804-1823.",Church history. ,Allgemeine Geschichte der christlichen Kirche nach der Zeitfolge / von Heinrich Philipp Konrad Henke.,,,,,German
