Creator,Imprint,Subject,Title,Series,Relation,Edition,Medium Type,Language
"Rollin, Charles","London : Printed for C. Hitch ..., 1749.",Education--Early works to 1800.   Education.   Early works. ,"The method of teaching and studying the belles lettres, or, An introduction to languages, poetry, rhetoric, history, moral philosophy, physicks, andc. : with reflections on taste, and instructions with regard to the eloquence of the pulpit, the bar, and the stage ... / by Mr. Rollin ... ; translated from the French.",,,The 4th ed.,,English
Brethren's Society for the Furtherance of the Gospel among the Heathen.,"London : Brethen's Society for the Furtherance of the Gospel, 1790-1889.",Moravian Church--Missions--Periodicals.   Moravian Church.   Missions.  and others,Periodical accounts relating to the missions of the Church of the United Brethren established among the heathen.,,,,,English
"Smollett, T.","London, Printed for J. Rivington and J. Fletcher, at the Oxford-Theatre, 1758-60.",Great Britain--History.   Grande-Bretagne--Histoire.   Great Britain.  and others,"A Complete history of England, from the descent of Julius Caesar, to the Treaty of Aix la Chapelle, 1748. Containing the transactions of one thousand eight hundred and three years.",,,2d ed.,,English
"Warburton, William","London : Printed for J. and P. Knapton, 1755-1758.","Bible. Pentateuch Evidences, authority, etc.   Bible. Pentateuch.   Deism--Controversial literature.  and others",The divine legation of Moses / in nine books ; by W. Warburton ...,,,"The 4th ed., corr. and enl.",,English
"Pope, Alexander","London : Printed for A. Millar, J. and R. Tonson, C. Bathurst, H. Woodfall, R. Baldwin, W. Johnston ... [and 6 others], 1764.",,"The works of Alexander Pope, Esq. in six volumes complete. : With his last corrections, additions, and improvements ; together with all his notes, as they were delivered to the editor a little before his death: printed verbatim from the octavo edition of Mr. Warburton.",,,,,English
"Chambers, Ephraim","London : Printed for J.F. and C. Rivington ..., 1788-1791.",Encyclopedias and dictionaries--Early works to 1800.   Encyclopedias and dictionaries.   Early works. ,"Cyclopædia:, or, An universal dictionary of arts and sciences : containing an explanation of the terms, and an account of the several subjects, in the liberal and mechanical arts, and the sciences, human and divine : intended as a course of ancient and modern learning / by E. Chambers, F.R.S. ... : with the supplement and modern improvements incorporated in one alphabet by Abraham Rees, D.D.F.R.S. : in four volumes ...",,,[New ed.].,,English
"Hallam, Henry","Philadelphia, T. Dobson, 1821.",476 - 1492   Middle Ages.   Europe--History--476-1492.  and others,View of the state of Europe during the middle ages.,,,,,English
Columbian College in the District of Columbia. Library.,"[London : London Society for Promoting Christianity amongst the Jews, 1813-1815]",Christianity and other religions--Judaism--Periodicals.   Judaism--Relations--Christianity--Periodicals.   Missions to Jews--Periodicals.  and others,The Jewish repository.,,,,,English
"Schleusner, Johann Friedrich","Lipsiae, Weidmannia, 1820-21.","Greek language, Biblical--Dictionaries--Latin.   Greek language--Dictionaries--Polyglot.   Hebrew language--Dictionaries--Polyglot.  and others","Novvs thesavrvs philologico-criticvs: sive, Lexicon in LXX et reliqvos interpretes Graeco ac scriptores apocryphos Veteris Testamenti. Post Bielium, et alios viros doctos congessit et edidit Joh. Fried. Schleusner.",,,,,English
"Bertinoro, Obadiah","Amstelaedami, Excudunt Gerard and Jacobus Borstius, 1698-1703.",Mishnah Commentaries.   Mishnah.   Commentaries. ,"Mischna; sive totius Hebraeorum juris, rituum, antiquitatum, ac legum oralium systema, cum clarissimorum rabbinorum Maimonidis and Bartenorae commentariis integris ... Latinitate donavit ac notis illustravit Guilielmus Surenhusius.",,,,,Latin
"Flacius Illyricus, Matthias","Basileæ : Typis and expensis Ludovici Regis, 1624.","30 - 1500   Church history--Middle Ages, 600-1500.   Church history--Primitive and early church, ca. 30-600.  and others","Historia ecclesiastica : integram ecclesiæ Christianæ conditionem, indè à Christo ex Virgine nato, juxta seculorum seriem exponens / jam olim per studiosos ac pios aliquot viros, in urbe Magdeburgicâ, and alibi, ex vetustissimis and optimis historicis, patribus, and aliis scriptoribus, diligenter congesta ; nunc denuo per Ludovicum Lucium, fideliter recensita.",,,,,Latin
"Montesquieu, Charles de Secondat","Printed at Worcester : By Isaiah Thomas, Jun., sold by him, and by Mathew Carey, Philadelphia ..., July 1802.",Jurisprudence.   Law--Philosophy.   Political science.  and others,"The spirit of laws / translated from the French of M. de Secondat, baron de Montesquieu.",,,1st American from the 5th London ed.,,English
"Chesterfield, Philip Dormer Stanhope","London : J. Dodsley, 1777.",Conduct of life.   Etiquette. ,"Letters written by the late Right Honourable Philip Dormer Stanhope, earl of Chesterfield : to his son, Philip Stanhope, esq ; ... Together with several other pieces on various subjects. / Pub. by Mrs. Eugenia Stanhope, from the originals now in her possession.",,,8th ed.,,English
"Jefferson, Thomas","Philadelphia : Printed by Jane Aitken ..., 1808.",Bible. Greek Translations into English.   Bible. Greek Old Testament. Versions Septuagint. ,"The Holy Bible : containing the Old and New Covenant, commonly called the Old and New Testament / translated from the Greek by Charles Thomson ...",,,,,English
"Russell, William","Philadelphia : A. Small, [1815]",Europe--History.   Europe.   History. ,"The history of modern Europe : with an account of the decline and fall of the Roman empire : and a view of the progress of society, from the rise of the modern kingdoms to the peace of Paris, in 1763 : in a series of letters from a nobleman to his son.",,,A new ed.,,English
"Horne, Thomas Hartwell","London : T. Cadell, 1822.",Bible Bibliography.   Bible Introductions.   Bible.  and others,An introduction to the critical study and knowledge of the Holy Scriptures / by Thomas Hartwell Horne.,,,"3rd ed.,",,English
"Scott, Thomas","Philadelphia : Printed for W.W. Woodward, 1810.","Church of England--Sermons.   Church of England.   Sermons, English.  and others","Theological works : published at different times, and now collected into volumes / by Thomas Scott.",,,1st American ed.,,English
"Jones, William","New York, S.H. Cone, 1824.",Albigenses.   Church history.   Waldenses. ,"The history of the Christian church, from the birth of Christ to the eighteenth century, including the very interesting account of the Waldenses and Albigenses. By William Jones.",,,1st American from the 4th London ed.,,English
"Michaelis, Johann David","London : Printed for F.C. and J. Rivington ..., and Longman, Hurst, Rees, Orme, and Brown ..., and A. Brown and Company, Aberdeen, 1814.","Bible. Pentateuch Criticism, interpretation, etc.   Bible. Pentateuch Law.   Bible. Pentateuch.  and others","Commentaries on the laws of Moses / by the late Sir John David Michaelis ; translated from the German by Alexander Smith, D.D.",,,,,English
"Crosby, Thomas","London, The editor, 1738-40.",Baptists--England.   Baptists.   England. ,"The history of the English Baptists, from the Reformation to the beginning of the reign of King George I.",,,,,English
"Keach, Benjamin","London : L.I. Higham, 1815-1818.","Jesus Christ--Parables.   Bible. New Testament. Gospel Criticism, interpretation, etc. ","Gospel mysteries unveiled, or, An exposition of all the parables, and many express similitudes, spoken by our Lord and Savior Jesus Christ : wherein also many things are doctrinally handled, and practically improved by way of application, with a supplement to the whole / by Benjamin Keach.",,,,,English
"Clarkson, Thomas","London : Longman, Hurst, Rees, and Orme, 1808.",Great Britain.--Parliament--History.   Abolitionists--Great Britain.   Antislavery movements--History--18th century.  and others,"The history of the rise, progress, and accomplishment of the abolition of the African Slave-trade by the British parliament / by Thomas Clarkson, M.A.",,,,,English
"Malte-Brun, Conrad","Edinburgh : A. Black, 1821-1833.",Geography.   Physical geography. ,"Universal geography, or, a description of all the parts of the world, on a new plan : according to the great natural divisions of the globe ; accompanied with analytical, synoptical, and elementary tables / by M. Malte-Brun.",,,,,English
"Smollett, T.","London : Richard Baldwin, 1763-1768.","1727 - 1820   Great Britain--History.   Great Britain--History--George II, 1727-1760.  and others",Continuation of The complete history of England / by T. Smollett.,,,,,English
Columbian College in the District of Columbia. Library.,"London, J. Duncan [et cetera] 1816",Missions to Jews--Periodicals.   Missions to Jews.   Periodicals. ,The Jewish expositor and friend of Israel; containing monthly communications respecting the Jews and the proceedings of the London Society.,,,,,English
"Saurin, Jacques","New-York : Printed by L. Nichols ..., 1803-1807.","Reformed Church--Sermons.   Sermons, English--Translations from French.   Sermons, French--Translations into English.  and others",Sermons / translated from the original French of the late Rev. James Saurin ... by the Rev. Robert Robinson.,,,,,English
"Moor, Bernhard de","Lugduni-Batavorum, Johannem Hasebroek, 1761-1771.","Marck, Johannes à.--Compendium theologiæ christianæ didactico-elencticum. ",Commentarius perpetuus in Johannis Marckii. Compendium theologiae christianae didactico-elencticum.,,,,,Latin
Plutarch.,"Philadelphia : Brannan and Morford, 1811.",Greece--Biography.   Rome--Biography.   Greece.  and others,"Plutarch's lives / translated from the original Greek, with notes critical and historical, and a life of Plutarch, by John Langhorne and William Langhorne.",,,"New ed., with corrections and additions /",,English
"Beattie, James","Philadelphia : Published by Hopkins and Earle, Fry and Kammerer, printers, 1809.","Beattie, James Hay,--1768-1790.   1700 - 1799   Apologetics--History--18th century.  and others","The works of James Beattie, LL. D.",,,,,English
"Pope, Alexander","Dublin : Printed for G. Faulkner and A. Bradley, 1769.",,"The works of Alexander Pope, Esq. : in nine volumes, complete / with his last corrections, additions, and improvements ; together with the commentary and notes of his editor.",,,,,English
Raynal,"Geneve, Chez J.L. Pellet, 1780.",Colonization--History.   Commerce--History.   Colonisation--Histoire.  and others,Histoire philosophique et politique des établissemens et du commerce des Européens dans les deux Indes. Par Guillaume-Thomas Raynal ...,,,,,French
"Wilson, Alexander","Philadelphia, Bradford and Inskeep, 1808-14.",Birds--Pictorial works.   Birds--United States.   Birds.  and others,"American ornithology; or, The natural history of the birds of the United States: illustrated with plates, engraved and colored from original drawings taken from nature. By Alexander Wilson.",,,,,English
Teyler's Tweede Genootschap.,"Haarlem : De Erven F. Bohn, 1781-",Science. ,Verhandelingen / uitgegeven door Teyler's Tweede Genootschap.,,,,,Dutch
"Scio de San Miguel, Felipe","Paris : J. Smith, 1822.",Teologia Pastoral. ,"El Nuevo Testamento / traducido al español de la Vulgata latina, por el Rmo. P. Phelipe Scio de S. Miguel.",,,,,Spanish
"Guénée, Antoine","Philadelphia : Printed by William Young, bookseller, MDCCXCV [1795]","Voltaire,--1694-1778.   Bible. Old Testament Evidences, authority, etc.   Bible. Old Testament.  and others","Letters of certain Jews to Monsieur Voltaire : containing an apology for their own people and for the Old Testament ; with critical reflections and a short commentary extracted from a greater / translated by the Rev. Philip Lefanu, D.D.",,,,,English
"Leslie, Charles","London : Printed and sold by B.R. Goakman, at the London Society's Repository ... : 1812.",Christianity and other religions--Judaism.   Judaism--Controversial literature.   Christianity.  and others,"A short and easy method with the Jews : wherein the certainty of the Christian religion is demonstrated / by the Rev. Charles Leslie, M.A.",,,A new ed. /,,English
"Bézout, Etienne","Paris : Patris, 1810.",Geometry.   Trigonometry. ,"Cours de mathématiques, a l'usage de la marine et de l'artillerie. Seconde partie, contenant les élémens de la goémétrie [sic], la trigonométrie rectiligne et la trigonométrie sphérique / par Bézout.",,,"Nouv. éd., revue avec le plus grand soin /",,French
"Emmons, Nathanael","Boston : Printed by Samuel T. Armstrong, numbers 50, Cornhill, 1813.","Sermons, American.   Sermons. ","A collection of sermons : which have been preached on various subjects, and published at various times / by Nathanael Emmons, D.D. pastor of the church in Franklin.",,,,,English
"Williams, Thomas","Philadelphia : Printed by William W. Woodward, numbers 52, South second, corner of Chesnut-street, 1803.",Bible. Song of Solomon Commentaries.   Bible. Song of Solomon.   Commentaries. ,"The Song of songs, which is by Solomon. A new translation: with a commentary and notes. By T. Williams.",,,,,English
"Campbell, George","Edinburgh : Creech, Hill, Ogle, 1812.","Hume, David,--1711-1776.--Essay on miracles.   Church of Scotland--Sermons.   Miracles. ","A dissertation on miracles : containing an examination of the principles advanced by David Hume, Esq. in an essay on miracles : with a correspondence on the subject by Mr. Hume, Dr. Campbell, and Dr. Blair, to which are added sermons and tracts / by George Campbell.",,,,,English
Euclid.,"Philadelphia, T. Desilver and R. Desilver, 1825.","Geometry--Early works to 1800.   Geometry.   Mathematics, Greek.  and others","The Elements of Euclid, viz. the first six books, together with the eleventh and twelfth. The errors, by which Theon, or others, have long ago vitiated these books, are corrected, and some of Euclid's demonstrations are restored. Also, the book of Euclid's Data, in like manner corrected. By Robert Simson ... To this edition are also annexed, Elements of plane and spherical trigonometry.",,,,,English
"Peyrard, F.","Paris : Patris, 1810.","Bézout, Etienne,--1730-1783.   Bézout, Etienne,--1730-1783   Geometry. ",La géometrie de Bézout / démontrée plus rigoureusement par F. Peyrard.,,,,,French
"Tappan, David","[Cambridge] W. Hilliard and E. Lincoln, 1807.",Bible Antiquities.   Bible.   Antiquities.  and others,"Lectures on Jewish antiquities; delivered at Harvard university in Cambridge, A.D. 1802 and 1803. By David Tappan.",,,,,English
"Marsden, William","London : The Author, 1812.",Malay language--Grammar.   Maleis. ,A grammar of the Malayan language / with an introduction and praxis ... by William Marsden ...,,,,,English
"Gill, John","Philadelphia : Printed for Delaplaine and Hellings by B. Graves, 1810.","1700 - 1799   Theology, Doctrinal--18th century.   Theology, Doctrinal. ","Gill's complete body of practical and doctrinal divinity : being a system of evangelical truths, deduced from the Sacred Scriptures / abridged by William Staughton, D.D.",,,,,English
"Brande, William Thomas","New-York : George Long, 1821.",Chemistry.   Chemical Phenomena. ,"A manual of chemistry : containing the principal facts of the science, arranged in the order in which they are discussed and illustrated in the lectures at the Royal Institution of Great Britain / by William Thomas Brande.",,,"First American, from the second London edition, to which are added notes and emendations /",,English
"Fénelon, François de Salignac de La Mothe-","Harrisburgh, Printed and sold by William Gillmor, 1811.",1811.   God.   Ontology. ,"A demonstration of the existence and attributes of God, drawn from the knowledge of nature, from proofs purely intellectual, and from the idea of the Infinite Himself. By Mr. Fenelon ...",,,,,English
"Coxe, Richard S. ","Burlington, N.J., D. Allinson and Company, 1813.",English language--Dictionaries.   English language.   Dictionaries. ,"A new critical pronouncing dictionary of the English language ... To which will be prefixed, Mr. Walker's principles of English pronunciation ... Compiled from authors of the most approved reputation: with considerable additions. By an American gentleman ...",,,,,English
"Taylor, Jeremy","Boston : Published by R.P. and C. Williams ..., 1820.",Christian life--Anglican authors.   Devotional exercises.   Prayers. ,"The rule and exercises of holy living : in which are described the means and instruments of obtaining every virtue, and, considerations serving to the resisting all temptations : together with prayers, containing the whole duty of a Christian, and the parts of devotion fitted for all occasions, and furnished for all necessities / by Jer. Taylor ...",,,Twenty-ninth ed. /,,English
"Sherlock, William","[Place of publication not identified] : [publisher not identified], [approximately 1810]",Death. ,A practical discourse concerning death / William Sherlock.,,,,,English
"Dodd, William","Philadelphia : Published by Robert Johnson, numbers 2, North Third Street, 1806.","Dodd, William,--1729-1777.   Dodd, William,--1729-1777 ","Thoughts in prison, and other miscellaneous pieces / by the Rev. William Dodd, L.L.D. : with a life of the author.",,,Johnson's ed.,,English
Euclid.,"Philadelphia, A. Walker [1819?]","Geometry--Early works to 1800.   Geometry.   Mathematics, Greek.  and others","The Elements of Euclid, viz. the first six books, together with the eleventh and twelfth. The errors, by which Theon, or others, have long ago vitiated these books, are corrected; and some of Euclid's demonstrations are restored. Also the book of Euclid's Data, in like manner corrected. By Robert Simson ... To this edition are also annexed, Elements of plane and spherical trigonometry.",,,,,English
"Ernesti, Johann August","Andover : Flagg and Gould, 1822.",Bible Hermeneutics.   Bible.   Hermeneutics. ,"Elements of interpretation / translated from the Latin of J.A. Ernesti and accompanied by notes, with an appendix containing extracts from Morus, Beck and Keil, by Moses Stuart.",,,,,English
"Frey, Joseph Samuel C. F. ","Newark, N.J. : Printed for the author, 1830.",Baptism. ,Essays on Christian baptism / by Joseph Samuel C.F. Frey.,,,"2d ed., rev. and much enl.",,English
"Massillon, Jean-Baptiste","New-York: Printed by D. and G. Bruce, for Brisban and Brannan, 186 Pearl-street, 1806.",Catholic Church--Pastoral letters and charges.   Catholic Church.   Pastoral theology--Catholic Church--Early works to 1800.  and others,"The charges of Jean Baptiste Massillon, bishop of Clermont, addressed to his clergy. Also, two essays: the one on the art of preaching, from the French of M. Reybaz, and the other on the composition of a sermon, as adapted to the Church of England ... by the Rev. Theops. St. John [pseudonym] ...",,,,,English
"Keith, Isaac Stockton","Charlestown [Mass.] : Printed by S. Etheridge, Jr., 1816.","Congregational churches--Sermons.   Congregational churches.   Sermons, American.  and others","Sermons, addresses, and letters / selected from the writings of the late Rev. Isaac Stockton Keith, D.D. one of the ministers of the Independent or Congregational Church in Charleston, S.C. ; to which are prefixed, an engraved portrait of the author, a brief sketch of his life, and the sermon preached on the occasion of his death, by Rev. Andrew Flinn, D.D.",,,,,English
"Day, Jeremiah","New Haven, Howe and Deforest, 1814.",Algebra. ,"An introduction to algebra; being the first part of a course of mathematics, adapted to the method of instruction in the American colleges.",,,,,English
Pomare ,"Tahiti, Printed at the Windward Mission Press, 1821.",Early printing--French Polynesia--Tahiti.   Linguistics--Tahitian--Texts. ,"Te Evanelia a Ioane, no Iesu Christ to tatou fatu; irithihia ei parau Tahiti.",,,,,Tahitian
"Goodman, John","London : Printed for R. Royston ..., 1681.","Church of England--Sermons.   Bible. Matthew XIX, 16.   Future life.  and others",A sermon preached before the Right Honourable the Lord Mayor and aldermen of London : at the Guild-Hall Chappel on Decemb. 18th 1681 / by Jo. Goodman ...,,,,,English
"Wardlaw, Ralph","Philadelphia, W.W. Woodward, 1822.",Bible. Ecclesiastes Commentaries.   Bible. Ecclesiastes.   Commentaries. ,Lectures on the book of Ecclesiastes. By Ralph Wardlaw ...,,,,,English
"Coccejus, Johannes","Lugduni Batavorum : Joahannem and Danielem Elsevier, 1652.",Bible. Minor Prophets Commentaries.   Bible. Minor Prophets.   Commentaries. ,Sive prophetae duodecim minores / versione latina et commentario illustrati a Johanne Coccejo.,,,,,Latin
"Goodman, John","London : Printed by E. Flesher, for R. Royston ..., 1679.",Prodigal son (Parable)--Early works to 1800.   Sin--Early works to 1800.   Prodigal son (Parable)  and others,"The penitent pardoned, or A discourse of the nature of sin, and the efficacy of repentance, under the parable of the prodigal son / by J. Goodman, D.D. rectour of Hadham.",,,,,English
"Ivimey, Joseph","Boston: : Published by E.E. Finch, sold by Lincoln and Edmands; Manning and Loring; Samuel T. Armstrong; Thomas Wells; Charles Callender; Nathaniel Willis. W. Crosby, printer., 1814.","Bunyan, John,--1628-1688--Portraits.   Bunyan, John,--1628-1688.   Intaglio prints.  and others","The life of Mr. John Bunyan, author of the ""Pilgrim's progress."" : In which is exemplified the power of evangelical principles. / By Joseph Ivimey. ; [Four lines of Scripture texts].",,,,,English
"Goodman, John","London : Printed for R. Royston ..., 1678.","Church of England--Sermons.   Bible. Matthew XVI, 18 Sermons.   Sermons, English--17th century. ","A sermon preached at Bishops-Stortford August 29. MDCLXXVII : before the Right Reverend father in God, Henry, Lord Bishop of London, andc. at his Lordships primary visitation / by Jo. Goodman, D.D., Rector of Hadham.",,,,,English
"South, Robert","London : Printed for Randal Taylor, near Stationers-Hall, 1693.","Sherlock, William,--1641?-1707.--Vindication of the doctrine.   Trinity--Early works to 1800. ","Animadversions upon Dr. Sherlock's book, entituled A vindication of the holy and ever-blessed Trinity, andc. : together with a more necessary vindication of that sacred, and prime article of the Christian faith from his new notions, and false explications of it : humbly offered to his admirers, and to himself the chief of them / by a divine of the Church of England.",,,,,English
"Seneca, Lucius Annaeus","Basilaea : Per Eusebium Episcopium, 1590.",,"L. Annaei Seneca philosophi, stoicorum omnium acutissimi opera, quae extant, omnia, in V I. tomos tributa ... / authore Dionysio Gothofredo I.C.",,,Nouae huic editioni accesserunt.,,Latin
"Pearce, Samuel","Philadelphia : Baptist General Tract Society, 18--?","Pearce, Samuel,--1766-1799. ","Memoirs of the late Rev. Samuel Pearce, A.M. : with extracts of some of his most interesting letters / compiled by Andrew Fuller.",,,,,English
"Johnson, Samuel","Montrose, Printed by D. Buchanan, sold by J. Fairbairn 1802.",English language--Dictionaries.   English language.   Dictionaries. ,"A dictionary of the English language: in which the words are deduced from their originals, explained in their different meanings, and authorized by the names of the writers in whose works they are found. Abstracted from the folio edition, by the author Samuel Johnson, LL. D. To which is prefixed a grammar of the English language.",,,"The twelfth ed.,",,English
"Hazlitt, William","Brooklyn, Printed by T. Kirk, 1810.","Speeches, addresses, etc., English. ","The Eloquence of the British Senate; being a selection of the best speeches of the most distinguished English, Irish, and Scotch Parliamentary speakers, from the beginning of the reign of Charles I, to the present time. With notes, biographical, critical, and explanatory by William Hazlitt.",,,,,English
"Patrick, Simon","London, Printed for Ri. Chiswell, 1699.",Bible. Numbers Commentaries.   Bible. Numbers.   Commentaries. ,"A commentary upon the fourth book of Moses, called Numbers. By the Right Reverend Father in God, Symon lord bishop of Ely.",,,,,English
"Willmet, Joannes","Rotterodami : C.R. Hake, 1784.","Ḥarīrī,--1054-1122.   Timur,--1336-1405.   Arabic language--Dictionaries.  and others",Lexicon linguae arabicae / in Coranum Haririum et vitam Timuri.,,,,,Latin
"Brissot de Warville, J.-P.","Neuchatel, Impr. de la Société typographique, et se vend à Paris chez Desauges 1782.",Truth. ,"De la verité, ou Méditations sur les moyens de parvenir à la vérité dans toutes les connoissances humaines. Par J.P. Brissot de Warville.",,,,,French
"Crooll, Joseph. ","London : [publisher not identified], 1814.",Judaism--Apologetic works.   Judaism.   Apologetic works. ,The restoration of Israel / by R. Joseph Crooll ; and An Answer by Thomas Scott.,,,,,English
"Vossius, Gerardus Joannes","Amsterdami, Apud Ioannem Blaev, 1668.",Idols and images--Worship.   Religions. ,"Gerardi Ioannis Vossii De theologia gentili, et physiologia Christiana; sive De origine ac progressv idololatriae; deqve natvrae mirandis, quibus homo addvcitvr ad Devm, libri IX, editio nova ...",,,,,Latin
"Ivimey, Joseph","London : Booth and Co, 1815.","Bunyan, John,--1628-1688. ",The life of Mr. John Bunyan ... in which is exemplified the power of evangelical principles ... / by Joseph Ivimey.,,,2d ed.,,English
"Goodman, John","London : Printed by J. Macock, for R. Royston ..., 1683.",Prodigal son (Parable)   Repentance.   Sin. ,"The penitent pardoned:, or, A discourse of the nature of sin, and the efficacy of repentance, under the parable of the Prodigal son. / by J. Goodman ...",,,The 2nd ed. corrected and enl.,,English
