Creator,Imprint,Subject,Title,Series,Relation,Edition,Medium Type,Language
Virgil.,"Londini : Typis T. Rickaby, impensis T. Payne, B. and J. White, R. Faulder, and J. Edwards, 1793.",,"P. Virgilius Maro in usum scholarum / ad Londinensem Heynii editionem exactus ; excisis disquisitionibus, excursibus, et notarum iis, quae ad juniorum commoditatem minus pertinere videbantur.",,,,,Latin
"Adam, Alexander","(George Long, printer) E.F. Backus, 1814.",Antiquities.   Rome--Antiquities.   Rome (Empire) ,"Roman antiquities = or, An account of the manners and customs of the Romans : designed chiefly to illustrate the Latin classics, by explaining words and phrases, from the rites and customs to which they refer / by Alexander Adam.",,,2d American ed.,,English
"Dick, John","Boston: Published by Lincoln and Edmands, numbers 53, Cornhill. John Eliot, jun. printer, 1811.",Bible Inspiration.   Bible.   Inspiration. ,"An essay on the inspiration of the Holy Scriptures of the Old and New Testament. By John Dick. To which is added, An essay on the inspiration of the apostles. By William Parry.",,,1st American ed.,,English
"Neander, August","Berlin, F. Dümmler, 1821-1822.","Johannes--Chrysostomus.   John Chrysostom,--Saint,---407.   Kirchengeschichte.  and others","Der heilige Johannes Chrysostomus und die Kirche, besonders des Orients, in dessen Zeitalter.",,,,,German
"Jacombe, Thomas","London, Printed by W. Godbid, and are to be sold by M. Pitt, R. Chiswel, and J. Robinson, 1672.",Church of England--Sermons.   Bible. Romans VIII Commentaries. ,"Several sermons preach'd on the whole eighth chapter of the Epistle to the Romans. Eighteen of which preach'd on the first, second, third, fourth verses are here published ... The first volume of the first part ...",,,,,English
"Metternich, Wolfe","Amstelaedami : Ex Officina, Wetsteniana, 1708.","Locke, John,--1632-1704.   Locke, John,--1632-1704   Faith and reason. ","Fides et ratio collatae, ac suo utraque loco redditae, adversus principia Joannis Lockii : insertis non paucis quibus revelationis divinae ac religionis Christianae capita digniora profundius confirmantur and explicantur, accessione triplici ... / edidit and praefatus est Petrus Poiret.",,,,,Latin
"Baldwin, Thomas",Boston : Printed and sold by Manning and Loring ... 1806.,1806   Baptism--Controversial literature.   Baptists--New England--Controversial literature.  and others,"The baptism of believers only, and the Particular Communion of the Baptist churches, explained and vindicated. In three parts. The first--Published originally in 1789; the second--In 1794; the third--An Appendix, containing Additional Observations and Arguments, with Strictures on several late Publications. By Thomas Baldwin ...",,,"2nd ed., rev.",,English
"Evans, John","London : Baldwin, Cradock, and Joy, 1821.",Religions.   Sects. ,"A sketch of the denominations of the Christian world : to which is prefixed, an outline of atheism, deism, theophilanthropism, Mahometanism, Judaism, and Christianity, with a persuasive to religious moderation / by John Evans.",,,14th ed.,,English
"Smith, Southwood","London : Sold by Sherwood, Neely, and Jones, 1822.",Future punishment--Controversial literature.   Future punishment.   Providence and government of God.  and others,Illustrations of the divine government / by T. Southwood Smith.,,,3d ed.,,English
"Gisborne, Thomas","London : Printed for T. Cadell and W. Davies, in the Strand, 1818.",Natural theology. ,The testimony of natural theology to Christianity / by Thomas Gisborne.,,,3rd ed.,,English
"Chalmers, Thomas","Andover : Flagg and Gould, printers, Published and sold by Mark Newman ; 1818.",Bible. Revelations Commentaries. ,The evidence and authority of the Christian revelation / by the Rev. Thomas Chalmers.,,,6th ed.,,English
"Etheridge, Samuel","Boston, Lincoln and Edmands, 1818.",1800 - 1870   Readers--1800-1870.   Elocution.  and others,"The Christian orator; or, A collection of speeches, delivered on public occasions before religious benevolent societies. To which is prefixed an abridgement of Walker's Elements of elocution. Designed for the use of colleges, academies, and schools. By a gentleman of Massachusetts.",,,"2d ed.,",,English
"Doddridge, Philip","Northampton [Mass.] : Printed for William Butler, for the Society for propagating the gospel among the Indians and others in North America; the Hampshire missionary Society, the trustees of Phillips's Andover academy. 1804.",Christian life. ,"The rise and progress of religion in the soul: illustrated in a course of serious and practical addresses ... with a devout meditation and prayer added to each chapter. To which is prefixed, A sermon on the care of the soul, and also subjoined, A plain and serious address to the master of a family, on the important subject of family religion. By the late Rev. Philip Doddridge.",,,,,English
"Ewing, John","Philadelphia : Hopkins and Earle, 1809.",Astronomy.   Physics. ,"A plain elementary and practical system of natural experimental philosophy : including astronomy and chronology / by the late Rev. John Ewing ; being the course of lectures delivered by him at that seminary, (enlarged and improved from time to time) for upwards of twenty years ; illustrated by copperplate engravings ; the whole carefully revised and prepared for the press, with sundry explanatory and supplementary notes ; by Robert Patterson ; with a biographical sketch of the author.",,,,,English
"Lowth, Robert","Oxonii : E Typographeo Clarendoniano, 1821.","Hare, Francis,--1671-1740.   Richter, Karl Friedrich,--1773-1806.--De aetate libri Jobi.   Weiss, Christian.  and others","De sacra poesi Hebraeorum : praelectiones academicae Oxonii habitae / a Roberto Lowth. Metricae Harianae brevis confutatio, et oratio Crewiana. Cum notis et epimetris / Joannis Davidis Michaelis ; suis animadversionibus adjectis edidit Ern. Frid. Car. Rosenmuller. Insunt Car. Frid. Richteri de aetate libri Jobi defienda. Atque Christ. Weisii de metro Hariano commentationes.",,,,,Latin
"Fraser, Alexander","Philadelphia : Printed for D. Hogan, from the Press of John Bioren, 1802.",Bible Prophecies.   Bible.   Prophecies. ,"A key to the prophecies of the Old and New Testaments : which are not yet accomplished: containing, I. Rules for their arrangement. II. Observations on their dates. III. A general view of the events foretold in them. / by Alexander Fraser.",,,,,English
"Cuninghame, William","London, Black, Parry, and Kingsbury, 1810.","Jesus Christ--Messiahship.   Levi, David,--1740-1799.--Dissertations on the prophecies of the Old Testament. ","Remarks upon David Levi's Dissertations on the prophecies relative to the Messiah: and upon the evidences of the divine character of Jesus Christ: addressed to the consideration of the Jews, by an inquirer, author of Letters on the evidences of Christianity, and various papers which have appeared in the Christian Observer, signed Talib [id est W. Cuninghame].",,,,,English
"Dodge, David Low","New York, Printed for the author by Collins and Perkins, 1808.",Christianity--Evidence.   Deism. ,"A religious conference, in four dialogues, between Lorenzo and Evander. By a layman ... To which is added, Leslie's Short method with deists.",,,,,English
"Veil, Charles Marie de","London : Printed for Francis Pearse at the Blew Anchor, at the West End of St. Pauls, 1685.",Bible. Acts Commentaries.   Bible. Acts.   Commentaries. ,"A literal explanation of the Acts of the holy apostles / written in Latine by C.M. DuVeil, D.D. Now translated into English out of a copy carefully reviewed and corrected by the author. To which is added a translation of a learned dissertation about Baptism for the dead, I Cor. 15.29. Written in Latine by the famous Fridericus Spannemius Filius ...",,,[Another ed.].,,English
"Paley, William","New York : James Eastburn and Company, 1817.",Apologetics.   Early works.   History. ,A view of the evidences of Christianity / in three parts / by William Paley.,,,,,English
"Chalmers, Thomas","Andover : Published by Mark Newman. Flagg and Gould, printers, 1818.",1800 - 1859   Religion and science--1800-1859.   Astronomy.  and others,Discourses on the Christian revelation viewed in connexion with the modern astronomy : together with six sermons embracing the last occasioned by the death of the Princess Charlotte of Wales / by Thomas Chalmers.,,,,,English
"Parmly, Levi Spear","New-York : Published for the author by Kirk and Mercein, numbers 22 Wall-street ; Broderick and Ritter, printers, numbers 2 Dey-street, 1820.",Teeth--Care and hygiene.   Teeth--Diseases.   Dentistry--Advertisements.  and others,"Lectures on the natural history and management of the teeth : the cause of their decay ; the art of preventing its accession ; and various operations, never hitherto suggested, for the preservation of such teeth as it is too frequently considered necessary to extract / by L.S. Parmly ...",,,,,English
"Evans, Caleb",Chiswick [England] : Whittingham ; 1822.,"Sermons, English.   Advertisements. ",Sermons / by the late Rev. Caleb Evans ; to which is annexed his Week's ramble to Glasgow and the western highlands : with a memoir by T. Southwood Smith.e.,,,,,English
"Venn, H. ","London : Ogle, Duncan, 1819.","Zacharias,--the priest, father of John the Baptist.   Benedictus Dominus Deus Israel Prophecies.   Salvation. ",Mistakes in religion exposed : an essay on the prophecy of Zacharias. / by H. Venn.,,,New ed.,,English
"Maclaurin, John","Philadelphia: : Published by W.W. Woodward, numbers 52, corner of Second and Chesnut streets. W. M'Culloch, printer., 1811.","Maclaurin, John,--1693-1754.   Gold tooled leather (Binding)   Stained leather (Binding)  and others","Sermons and essays: / by the late Rev. Mr. John M'Laurin, one of the ministers of Glasgow. ; Published from the author's manuscripts, by John Gillies, one of the ministers of Glasgow. ; To which is prefixed, some account of the life and character of the author.",,,,,English
"Baldwin, Thomas","Boston: : Printed and sold by Manning and Loring, numbers 2, Cornhill., 1810.","Worcester, Samuel,--1770-1821.--Serious and candid letters to the Rev. Thomas Baldwin.   Baptists--Controversial literature.   Gold tooled leather (Binding)  and others","A series of letters. In which the distinguishing sentiments of the Baptists are explained and vindicated: : in answer to a late publication, by the Rev. Samuel Worcester, A.M. addressed to the author, entitled ""Serious and candid letters."" / By Thomas Baldwin, D.D. Pastor of a Baptist church in Boston. ; [One line of Scripture text].",,,,,English
"Horsley, Samuel","Boston : Wells and Lilly, 1816.",Jesus Christ--Resurrection--Sermons.   Jesus Christ.   Church of England--Sermons--18th century.  and others,"Nine sermons, on the nature of the evidence by which the fact of our Lord's resurrection is established : and on various other subjects : to which is prefixed, A dissertation on the prophecies of the Messiah dispersed among the heathen / by Samuel Horsley.",,,,,English
"Clarke, Thomas. ","London : B.J. Holdsworth, 1820.",Freedom of religion--History.   Freedom of religion.   Persecution.  and others,"History of intolerance : with observations on the unreasonableness and injustice of persecution, and on the equity and wisdom of unrestricte d religious liberty / by Thomas Clarke.",,,,,English
"Howel, Laurence","Philadelphia : W.W. Woodward, [1807]",Bible History of Biblical events.   Bible.   History of Biblical events. ,"A complete history of the Holy Bible : as contained in the Old and New Testaments ; including also the ocurrences of four hundred years from the last of the prophets to the birth of Christ, and the life of our Blessed Saviour and his apostles, and c with copious notes, critical and explanatory, practical and devotional / from the text of the Rev. Laurence Howel ; with considerable additions and improvements by the Rev. George Burder.",,,,,English
Katholischer Priester.,"Te Amsterdam : Bij de Wed. G. Warnars en zoon, 1820.",Bible Study and teaching Catholic Church. ,"De bijbel niet, gelijk velen willen : een boek voor priesters alleen, maar ook voor vorst en volk / door een' Katholijken Priester uitgegeven ; uit het hoogduitsch.",,,,,Dutch
"Booth, Abraham","Newark, Printed by W. Tuttle and Company, 1805.",Infant baptism. ,"Paedobaptism examined, on the principles, concessions, and reasonings of the most learned paedobaptists, by Abraham Booth, abridged by Peter Bryant.",,,,,English
"Buck, Charles","Philadelphia, Printed for W.W. Woodward, numbers 52 south west corner of Chesnut and Second streets, 1818.",Theology--Dictionaries.   Theology.   Dictionaries. ,"A theological dictionary, containing definitions of all religious terms; a comprehensive view of every article in the system of divinity; an impartial account of all the principal denominations ... together with an accurate statement of the most remarkable transactions and events recorded in ecclesiastical history. By Charles Buck.",,,"5th American, from the 3d London ed., with additions. Also an account of the Cumberland Presbyterians in the United States.",,English
"Knight, Richard Payne","Lipsiae : In libraria Hahnia, 1816.","Homer--Criticism and interpretation.   Homer.   Criticism, interpretation, etc. ",Prolegomena ad Homerum : sive de carminum homericorum origine auctore et aetate itemque de priscae linguae progressu et praecoci maturitate / Scripsit Richardus Payne Knight ; praefatus est D. Fr. Ern. Ruhkopf.,,,,,Latin
"Simpson, David","London, Printed for W. Brown, and Robinson and Son, and Hardcastle, Leeds, 1812.",Jesus Christ--Divinity--Early works to 1800.   Jesus Christ.   Trinity--Early works to 1800.  and others,"A plea for the deity of Jesus, and the doctrine of the Trinity; being a chronological view of what is related concerning the person of Christ, the Holy Spirit, and the Trinity; whether in the sacred writings, or in Jewish, heathen, and Christian authors. By David Simpson. With a memoir of the author, and the spirit of modern Socinianism exemplified, andc. by Edward Parsons.",,,,,English
"Murray, Lindley","York [England] : Longman, Hurst, Rees, Orme, and Brown, 1820.",Christian biography. ,"The power of religion on the mind, in retirement, affliction, and at the approach of death : exemplified in the testimonies and experience of persons distinguished by their greatness, learning, or virtue / by Lindley Murray.",,,"17th ed., improved.",,English
"Gravesande, Willem Jacob 's","Lugduni Batavorum : Apud Petrum vander Aa, Bibliopolam and Typgraphum Academiae atque Civitatis, MDCCXXIII. [1723]","Newton, Isaac,--1642-1727.   Newton, Isaac,--1642-1727   Physics--Early works to 1800.  and others",Philosophiae Newtonianae institutiones : in usus academicos / G.J. s'Gravesande.,,,,,Latin
"Jones, William","London : T. Hamilton, 1821.","Bible. Hebrews Criticism, interpretation, etc.   Bible Language, style. ","Lectures on the figurative language of the Holy Scripture : and the interpretation of it from the Scripture itself ; to which are added, four lectures on the relation between the Old and New Testaments, as it is set forth in the Epistle to the Hebrews ; also, a single lecture on the natural evidences of Christianity / by William Jones ; to which is prefixed, a short account of his life and writings.",,,5th ed.,,English
"Fuller, Andrew","Otsego [N.Y.] Printed by H. and E. Phinney, jun. and sold by them at their bookstore, 1809.",Faith--Early works to 1800.   Faith.   Early works. ,"The gospel worthy of all acceptation : or, The duty of sinners to believe in Jesus Christ. With corrections and additions. To which is added, an appendix, on the question, whether the existence of any holy disposition of the heart be necessary in order to believing in Christ. By A. Fuller.",,,,,English
"Baxter, Richard","Springfield, Mass. : Published by Thomas Dickman, 1814.",Conversion--Early works to 1800.   Conversion.   Solitude--Religious aspects.  and others,"The miscellaneous works of the late Reverend, learned, and holy Richard Baxter : containing A call to the unconverted, to turn and live ... : also, Converse with God in solitude ... : likewise, The dying thoughts of the author.",,,,,English
"Ryland, John",Charlestown [Mass.] Printed by Samuel Etheridge. 1818.,"Fuller, Andrew,--1754-1815. ","The work of faith, the labour of love, and the patience of hope, illustrated; in the life and death of the Rev. Andrew Fuller, late pastor of the Baptist church at Kettering, and secretary to the Baptist missionary society ... Chiefly extracted from his own papers, by John Ryland, D.D.",,,,,English
"Newcome, Peter","London, printed by J.L. for J. Wyat, 1710.",Manners and customs--Sermons.   Manners and customs.   Sermons. ,"A sermon preach'd to the Societies for Reformation of Manners; at St. Mary-le-Bow, on Monday, December the 26th 1709. By Peter Newcome.",,,,,English
"Palmer, Samuel","London : Printed for R. Parker ... and A. Bell ..., 1710.",Church of England--Sermons.   Church of England.   Rebellion of 1641 (Ireland)  and others,"A sermon preach'd to the Protestants of Ireland now in London : at their anniversary meeting on Monday October 24. 1709. In commemoration of their deliverance from the bloody massacre begun by the Irish papists on the twenty third of that month in the year 1641. In the parish-church of St. Clements Danes. / by Samuel Palmer ... Publish'd at the request of the stewards, in behalf of themselves and the noblemen and gentlemen then present.",,,,,English
"Newton, Isaac","London : Printed for William and John Innys ..., 1721.",Light--Early works to 1800.   Optics--Early works to 1800.   Light.  and others,"Opticks, or, A treatise of the reflections, refractions, inflections and colours of light / by Sir Isaac Newton, Knt.",,,"The 3rd ed., corrected.",,English
"King, William","Cambridge : Printed for W. Thurlbourn and J. Woodyer in Cambridge, and J. Beecroft ... London., 1758.",Fall of man.   Good and evil.   Predestination. ,"An essay on the origin of evil. / by Dr. William King ... ; Translated from the Latin with large notes. To which are added, two sermons by the same author, the former concerning divine prescience, the latter on the fall of man.",,,The 4th ed. corrected. /,,English
"Foster, James","London, Printed for the author, and sold by Mr. Noon 1749-52.",Natural theology--Early works to 1900.   Christian ethics.   God.  and others,Discourses on all the principal branches of natural religion and social virtue. By James Foster ...,,,,,English
"Wollaston, William","London : Printed for J. and P. Knapton, 1750.","Wollaston, William,--1660-1724.   Natural theology--Early works to 1900.   Natural theology.  and others","The religion of nature delineated ... / by Mr. Wollaston ; to which is added, a preface containing a general account of the life, character, and writings of the author ; also a translation of the notes into English.",,,7th ed.,,English
"White, John","London, Printed for C. Davis, and W. Craighton at Ipswich, 1748.","Watts, Isaac,--1674-1748.--Humble attempt towards the revival of practical religion among Christians.   Church of England--Controversial literature.   Dissenters, Religious--England. ",Three letters to a gentleman dissenting from the Church of England. By John White ...,,,[4th ed.].,,English
"Douglass, William","London : Printed for R. And J. Dodsley, in Pall-mall, M D CC L X [1760]",1600 - 1775   Smallpox--Early works to 1800.   Smallpox--Vaccination--Early works to 1800.  and others,"A summary, historical and political, of the first planting, progressive improvements, and present state of the British settlements in North-America : containing I. Some general Account of ancient and modern Colonies, the granting and settling of the British Continent and West-India Island Colonies, with some transient Remarks concerning the adjoining French and Spanish Settlements, and other Remarks of various Natures. II. The Hudson's-Bay Company's Lodges, Fur and Skin Trade. III. Newfoundland Harbours and Cod-Fishery. IV. The Province of L'Acadie or Nova Scotia ; with the Vicissitudes of the Property and Jurisdiction thereof, and its present State. V. The several Grants of Sagadahock, Province of Main, Massachusetts-Bay, and New-Plymouth, united by a new Charter in the present Province of Massachusetts-Bay, commonly called New-England / by William Douglass, M.D. ; Vol. I. [One line from Cicero].",,,,,English
"Erasmus, Desiderius","London : Printed for Daniel Brown, George Strahan, B. Motte, and the executors of Richard Sare, 1725.","Erasmus, Desiderius,---1536.   Dialogues, Latin (Medieval and modern)--Translations into English.   Satire, Latin (Medieval and modern)--Translations into English. ","Twenty two select colloquies out of Erasmus Roterodamus : pleasantly representing several superstitious levities that were crept into the Church of Rome in his days / by Sir Roger L'Estrange, Kt. ; to which are added, seven more dialogues, with the life of the author, by Mr. Tho. Brown.",,,,,English
"Maseres, Francis","London : Printed by Samuel Richardson, and sold by Thomas Payne ..., 1758.","Machin, John,--m. 1751.   Circle-squaring--Early works to 1800.   Equations, Theory of--Early works to 1800.  and others","A dissertation on the use of the negative sign in algebra : containing a demonstration of the rules usually given concerning it, and shewing how quadratic and cubic equations may be explained, without the consideration of negative roots : to which is added, as an appendix, Mr. Machin's quadrature of the circle / by Francis Maseres ...",,,,,English
"Abernethy, John","Dublin, Printed; 1746.","Sermons, English.   Attributen van God. ","Discourses concerning the being and natural perfections of God; in which that first principle of religion, the existence of the Deity, is prov'd ...",,,,,English
"Williamson, Thomas","London, Printed by William Bulmer and Company Shakspeare Printing Office, for Edward Orme, printseller to his majesty, engraver and publisher, Bond-Street, the corner of Brook-Street., 1807.",Game and game-birds--India.   Hunting--Pictorial works.   Hunting--India.  and others,"Oriental field sports; being a complete, detailed, and accurate description of the wild sports of the East; and exhibiting, in a novel and interesting manner, the natural history of the elephant ... the whole taken from the manuscript and designs of Thomas Williamson, who served upwards of twenty years in Bengal; The drawings by Samuel Howett ... engraved by the first artists, under the direction of Edward Orme.",,,,,English
"Leland, John","London : Printed for B. Dod ..., 1756.","Bolingbroke, Henry St. John,--Viscount,--1678-1751.--Letters on the study and use of history.   Apologetics--Early works to 1800.   Apologetics--History--18th century.  and others","A supplement to the first and second volumes of the View of the deistical writers. : Containing additions and illustrations relating to those volumes. In several letters to a friend. : To which is added, Reflections on the late Lord Bolingbroke's Letters on the study and use of history, as far as relates to the Holy Scriptures. The third edition, corrected and enlarged. With a large index to the three volumes. / by John Leland, D.D.",,,,,English
"Sharpe, Gregory","London, Printed for John Millan, 1755.",1700 - 1799   Christianity--Early works to 1800.   Church history--18th century.  and others,"An argument in defence of Christianity, taken from the concessions of the most antient adversaries, Jews and pagans, philosophers and historians. In which is shewn, the different state of infidelity in those early times, from what it now is. To which is added, an apology for some of the first Christian fathers; with some remarks upon the genuineness of the four gospels. By Gregory Sharpe.",,,,,English
Columbian College in the District of Columbia. Library.,"London : Printed by Robert Barker ... and by the assignes of John Bill, 1634.",,"The Holy Bible : containing the Old Testament and the Nevv / newly translated out of the originall tongues ; and with the former translations diligently compared and revised, by his Majesties speciall command ; appointed to be read in churches.",,,,,English
"Buchanan, Claudius",Broxbourne [England] : Impensis Societatis ob Biblia Sacra ... : 1815.,Latin language--Texts.   Syriac language--Texts.   Latin language.  and others,"Evangelia Sancta, necnon Acta Apostolorum Syriace, cum interpretatione latina.",,,,,"Syriac, Modern"
Columbian College in the District of Columbia. Library.,"Kiøbenhavn : Det Kongelige Baisenhus, 1819.",,"Bible : det er den ganske hellige Skrifts Bøger / med Flid efterseete og rettede efter Grundtexten, saa og med mange Parallelsteder og udførlige Inholdsfortegnelser forsynede.",,,Sextende øplag.,,Danish
"Martini, Antonio","Londra : Dai torchj di Giuseppe S. Hughes, 1822.",Bible. 1822. Italian. Psalms. Vulgate.   Bible. 1822. Latin. Psalms. Vulgate.   Bible. Psalms. ,"Libro dei Salmi / tradotto in italiano secondo il testo della Volgata, da Monsignor Martini, riscontrato diligentemente sulla prima edizione di Torino da Giambattista Rolandi.",,,,,Italian
"Buchanan, Claudius",Londoni : Impensis Societatis ob Biblia Sacra ... : 1816.,,Novum Testamentum syriacè : denuò recognitum atque ad fidem codicum manuscriptorum emendatum.,,,,,"Syriac, Modern"
"Figueiredo, António Pereira de","Londres, B. Bensley, 1821.",,A Sancta Biblia; contendo o Velho e o Novo Testamento. Traduzidos em portuguez pelo padre Antonio Pereira de Figueiredo.,,,,,Portuguese
